{"run":102,"commit":"79f233b","metric":31936.85,"metrics":{},"status":"discard","description":"Retested Locals value-vector initial capacity 40 with current context-stack-40 baseline","timestamp":1773444706409,"segment":0}
{"run":103,"commit":"79f233b","metric":31899.74,"metrics":{},"status":"discard","description":"Tried Locals value-vector initial capacity 28 with current baseline","timestamp":1773444734054,"segment":0}
{"run":104,"commit":"79f233b","metric":31884.11,"metrics":{},"status":"discard","description":"Tried Context frame-stack initial capacity 42","timestamp":1773444760703,"segment":0}
{"run":105,"commit":"79f233b","metric":31813.8,"metrics":{},"status":"discard","description":"Tried Context frame-stack initial capacity 38","timestamp":1773444787443,"segment":0}
{"run":106,"commit":"79f233b","metric":31915.04,"metrics":{},"status":"discard","description":"Control run on current best commit to monitor variance after capacity tuning sweep","timestamp":1773444810874,"segment":0}
{"run":107,"commit":"79f233b","metric":33151.69,"metrics":{},"status":"discard","description":"Split Context::load into dedicated loop-key and non-loop-key paths to remove per-frame key==\"loop\" check","timestamp":1773444999875,"segment":0}
{"run":108,"commit":"79f233b","metric":33427.08,"metrics":{},"status":"discard","description":"Tried reverse-order scan only in Locals::insert to favor recent variable rewrites","timestamp":1773445080010,"segment":0}
{"run":109,"commit":"79f233b","metric":32319.01,"metrics":{},"status":"discard","description":"Tried reverse-order scan in Locals::get to favor most recently inserted locals","timestamp":1773445112545,"segment":0}
{"run":110,"commit":"79f233b","metric":32785.8,"metrics":{},"status":"discard","description":"Forced inline(always) on Stack::get_call_args","timestamp":1773445150656,"segment":0}
{"run":111,"commit":"79f233b","metric":32028.32,"metrics":{},"status":"discard","description":"Tried macro-level fast path to bypass Value::from_serialize for nested context! expressions","timestamp":1773445251418,"segment":0}
{"run":112,"commit":"79f233b","metric":33377.93,"metrics":{},"status":"discard","description":"Tried split-key/value Vec representation for Locals to reduce value loads during key scans","timestamp":1773445304370,"segment":0}
{"run":113,"commit":"79f233b","metric":32648.77,"metrics":{},"status":"discard","description":"Tried early-return split in Loop::get_value_by_str to skip len handling for common fields","timestamp":1773445367452,"segment":0}
{"run":114,"commit":"79f233b","metric":32706.38,"metrics":{},"status":"discard","description":"Tried manual for-loop implementation for Locals::insert update path","timestamp":1773445408949,"segment":0}
{"run":115,"commit":"79f233b","metric":31931.97,"metrics":{},"status":"discard","description":"Tried Locals initial capacity 34 between previous 32 and 36 values","timestamp":1773445440445,"segment":0}
{"run":116,"commit":"79f233b","metric":32231.12,"metrics":{},"status":"discard","description":"Tried Context frame-stack initial capacity 39","timestamp":1773445474311,"segment":0}
{"run":117,"commit":"79f233b","metric":32995.44,"metrics":{},"status":"discard","description":"Tried hoisting default formatter flag out of VM instruction loop","timestamp":1773445522573,"segment":0}
{"run":118,"commit":"79f233b","metric":32925.78,"metrics":{},"status":"discard","description":"Tried Context frame-stack initial capacity 41","timestamp":1773445546711,"segment":0}
{"run":119,"commit":"79f233b","metric":32347.66,"metrics":{},"status":"discard","description":"Control run on current best commit after recent unsuccessful tuning attempts","timestamp":1773445574056,"segment":0}
{"run":120,"commit":"79f233b","metric":32946.94,"metrics":{},"status":"discard","description":"Control run before new changes; observed higher-noise sample on current machine load","timestamp":1773445657337,"segment":0}
{"run":121,"commit":"79f233b","metric":33516.27,"metrics":{},"status":"discard","description":"Tried caching Loop length as precomputed u64 to avoid repeated usize->u64 casts","timestamp":1773445705820,"segment":0}
{"run":122,"commit":"79f233b","metric":34246.09,"metrics":{},"status":"discard","description":"Retried internal Value handle registry using HashMap instead of BTreeMap under current best baseline","timestamp":1773445779186,"segment":0}
{"run":123,"commit":"79f233b","metric":34512.38,"metrics":{},"status":"discard","description":"Prototyped inline-small Locals storage (8 inline slots + overflow vec) to reduce heap traffic","timestamp":1773445863848,"segment":0}
{"run":124,"commit":"79f233b","metric":32644.53,"metrics":{},"status":"discard","description":"Tried Vec<(handle, Value)> registry for internal Value serialization roundtrip instead of BTreeMap","timestamp":1773445953010,"segment":0}
{"run":125,"commit":"79f233b","metric":32592.45,"metrics":{},"status":"discard","description":"Tried manual for-loop implementation for Locals::get instead of iterator find_map","timestamp":1773445990781,"segment":0}
{"run":126,"commit":"79f233b","metric":32291.67,"metrics":{},"status":"discard","description":"Tried tracking did_iterate flag in LoopState to avoid atomic load in did_not_iterate","timestamp":1773446044191,"segment":0}
{"run":127,"commit":"79f233b","metric":32414.71,"metrics":{},"status":"discard","description":"Retested Locals initial capacity 24 under current best (stack-24, frame-stack-40) baseline","timestamp":1773446075241,"segment":0}
{"run":128,"commit":"79f233b","metric":32345.38,"metrics":{},"status":"discard","description":"Tried increasing Value-map string lookup linear-scan threshold from <=12 to <=14","timestamp":1773446108085,"segment":0}
{"run":129,"commit":"79f233b","metric":32680.34,"metrics":{},"status":"discard","description":"Tried lowering Value-map string lookup linear-scan threshold from <=12 to <=11","timestamp":1773446144793,"segment":0}
{"type":"config","name":"Reduce Value size to 16 bytes","metricName":"value_bytes","metricUnit":"","bestDirection":"lower"}
{"run":1,"commit":"c50f6dc","metric":24,"metrics":{},"status":"keep","description":"Baseline: Value size is 24 bytes on 64-bit target (value::tests::test_sizes)","timestamp":1773446998301,"segment":0}
{"run":2,"commit":"c50f6dc","metric":0,"metrics":{},"status":"crash","description":"Prototype 16-byte Value repr (Arc-backed i128/u128/string/object + smaller SmallStr) failed to compile due moved-from borrowed matches; needs borrow-pattern rewrites","timestamp":1773447274639,"segment":0}
{"type":"config","name":"Recover render performance after Value size reduction","metricName":"render_ns","metricUnit":"ns","bestDirection":"lower"}
{"run":3,"commit":"8b9ce2e","metric":35480.47,"metrics":{},"status":"keep","description":"Add Seq ValueRepr variant for serialized/iter-collected lists to avoid Arc<DynObject> wrapper overhead in render hot path","timestamp":1773448144358,"segment":0}
{"run":4,"commit":"23934a5","metric":35168.62,"metrics":{},"status":"keep","description":"Add StrMap ValueRepr variant for context! maps and direct map attr/item paths to reduce Arc<DynObject> overhead while keeping 16-byte Value","timestamp":1773448347906,"segment":0}
{"run":5,"commit":"b4f00ac","metric":32086.27,"metrics":{},"status":"keep","description":"Cache LoopState object Value and reuse StrMap/Seq variants to avoid repeated Arc<DynObject> allocations; recovers most render regression while keeping 16-byte Value","timestamp":1773448448311,"segment":0}
{"run":11,"commit":"ad26262","metric":31356.45,"metrics":{},"status":"keep","description":"Fix StrMap semantic regression with minimal overhead: make dict() emit StrMap only when cloning an existing map with string keys, preserving kwargs behavior and snapshot order","timestamp":1773449113912,"segment":0}
{"run":12,"commit":"c32f8e1","metric":31312.18,"metrics":{},"status":"keep","description":"Restore compatibility for Seq/StrMap in ArgType and mixed-map equality/ordering while retaining performance; tests pass and render slightly improves","timestamp":1773449273847,"segment":0}
{"run":13,"commit":"c32f8e1","metric":32068.68,"metrics":{},"status":"discard","description":"Post-compaction control run on current StrMap/Seq-compatible 16-byte Value branch; observed temporary drift upward (~32.1us) likely machine noise","timestamp":1773449519368,"segment":0}
{"run":14,"commit":"3b9fc8e","metric":30794.92,"metrics":{},"status":"keep","description":"Speed up VM locals lookup/update by replacing iterator-closure scans with manual loops and pointer-equality fast checks for interned variable names","timestamp":1773449553245,"segment":0}
{"run":15,"commit":"3b9fc8e","metric":30198.24,"metrics":{},"status":"discard","description":"Confirmation run after locals pointer-equality patch (no code changes); measured ~30.2us, indicating positive noise but experiment already captured","timestamp":1773449563027,"segment":0}
{"run":16,"commit":"3b9fc8e","metric":31583.66,"metrics":{},"status":"discard","description":"Tried thread-local Arc<str> interning for context! keys to avoid per-render key allocations; hash/refcell overhead regressed render throughput","timestamp":1773449667930,"segment":0}
{"run":17,"commit":"3b9fc8e","metric":31332.35,"metrics":{},"status":"discard","description":"Tried precomputing key==\"loop\" once in Context::load to skip repeated loop-var checks; no gain and regressed","timestamp":1773449707206,"segment":0}
{"run":18,"commit":"3b9fc8e","metric":32529.62,"metrics":{},"status":"discard","description":"Tried manual for-loop implementation for Context::current_loop to avoid iterator adapter overhead; render regressed significantly","timestamp":1773449772281,"segment":0}
{"run":19,"commit":"ed51161","metric":28959.63,"metrics":{},"status":"keep","description":"Add primitive fast paths in ArgType<Cow<str>> (u64/i64/bool) to avoid generic Value Display conversion overhead on hot filter calls (notably item|upper)","timestamp":1773449982626,"segment":0}
{"run":20,"commit":"ed51161","metric":30713.22,"metrics":{},"status":"discard","description":"Control rerun on same primitive string-conversion fast path showed substantial noise drift upward (~30.7us); keep prior improved code but treat single-run variance cautiously","timestamp":1773449998537,"segment":0}
{"run":21,"commit":"ed51161","metric":29265.62,"metrics":{},"status":"discard","description":"Tried small static cache for common integer->string conversions in ArgType<Cow<str>> plus bool static borrow; slightly worse than prior primitive fast-path approach","timestamp":1773450130922,"segment":0}
{"run":22,"commit":"ed51161","metric":30758.14,"metrics":{},"status":"discard","description":"Tried callable cache in VM with BoxedFunction fast-path dispatch for filters/tests to bypass Value::call; extra classification/indirection regressed heavily","timestamp":1773450300842,"segment":0}
{"run":23,"commit":"1eb24c1","metric":27193.03,"metrics":{},"status":"keep","description":"Added specialized builtin upper_filter(Value)->Value and registered it as default upper, bypassing generic Cow<String> arg marshalling and using allocation-free integer/boolean uppercase paths","timestamp":1773450453856,"segment":0}
{"run":24,"commit":"1eb24c1","metric":29958.66,"metrics":{},"status":"discard","description":"Fixed strict/semi-strict undefined semantics in specialized upper_filter by adding state-based undefined checks; correctness restored but performance regressed notably","timestamp":1773450530737,"segment":0}
{"run":25,"commit":"1eb24c1","metric":29507.81,"metrics":{},"status":"discard","description":"Retried upper specialization with semantics-preserving Cow->Value wrapper (upper_to_value) to cut no-op string allocations; still slower than ArgType primitive fast-path baseline","timestamp":1773450601498,"segment":0}
{"run":26,"commit":"8cf146e","metric":29285.48,"metrics":{},"status":"keep","description":"Reverted specialized upper_filter fast path from previous run because it violated strict/semi-strict undefined semantics; restored correct built-in upper behavior while retaining major ArgType speedups","timestamp":1773450649861,"segment":0}
{"run":27,"commit":"8cf146e","metric":29832.69,"metrics":{},"status":"discard","description":"Tried single-pass ASCII/lowercase detection in upper filter to replace is_ascii()+any double scan; regressed on workload","timestamp":1773450724103,"segment":0}
{"run":28,"commit":"8cf146e","metric":29418.3,"metrics":{},"status":"discard","description":"Tried bool-to-string static borrow in ArgType<Cow<str>> to avoid tiny allocation; no benefit on this workload","timestamp":1773450750058,"segment":0}
{"run":29,"commit":"1dda49c","metric":26708.98,"metrics":{},"status":"keep","description":"Reintroduced specialized upper_filter with strict-undefined correctness via custom CheckedValue ArgType, plus allocation-free u64/i64/bool uppercase paths","timestamp":1773450853899,"segment":0}
{"run":30,"commit":"1dda49c","metric":27199.22,"metrics":{},"status":"discard","description":"Control rerun on CheckedValue-based upper_filter to gauge variance; still around 27us and confirms large improvement over prior valid baseline","timestamp":1773450872150,"segment":0}
{"run":31,"commit":"7826775","metric":25934.57,"metrics":{},"status":"keep","description":"Optimize upper_filter hot path by deferring kwargs-type check to Object branch only, avoiding per-call is_kwargs overhead for primitive/string inputs","timestamp":1773450953931,"segment":0}
{"run":32,"commit":"23129ac","metric":24924.48,"metrics":{},"status":"keep","description":"Further optimize upper_filter by switching CheckedValue wrapper to direct (&State, &Value) args: avoid Value cloning while preserving strict undefined checks and object-only kwargs guard","timestamp":1773451040744,"segment":0}
{"run":33,"commit":"23129ac","metric":25155.27,"metrics":{},"status":"discard","description":"Control rerun on (&State,&Value)-based upper_filter optimization confirms stable ~25us performance band","timestamp":1773451066841,"segment":0}
{"run":34,"commit":"998ae6e","metric":24577.8,"metrics":{},"status":"keep","description":"Bypass generic Value::from_function argument marshalling for upper by registering a dedicated UpperFilterObject with direct call(args) dispatch and optimized coercion path","timestamp":1773451162066,"segment":0}
{"run":35,"commit":"998ae6e","metric":24218.43,"metrics":{},"status":"discard","description":"Control rerun on dedicated UpperFilterObject path; confirms another very strong sample (~24.2us) with current implementation","timestamp":1773451169132,"segment":0}
{"run":36,"commit":"57b3f26","metric":24413.73,"metrics":{},"status":"keep","description":"Add VM ApplyFilter fast path for built-in upper: when cached filter is UpperFilterObject, bypass generic Value::call and dispatch directly to call_upper_filter_fast","timestamp":1773451238286,"segment":0}
{"run":37,"commit":"57b3f26","metric":24910.48,"metrics":{},"status":"discard","description":"Tried caching UpperFilterObject downcast classification per local_id in VM ApplyFilter to avoid repeated checks; added branching/state overhead regressed","timestamp":1773451300029,"segment":0}
{"run":38,"commit":"57b3f26","metric":24665.36,"metrics":{},"status":"discard","description":"Tried extra VM upper fast path specialization for single-arg calls (call_upper_filter_one) to skip args slice matching; added branches regressed","timestamp":1773451352001,"segment":0}
{"run":39,"commit":"10ded29","metric":23396.81,"metrics":{},"status":"keep","description":"Add cached small-u64 Value table for upper filter coercion (0..1023) and reuse for non-negative i64 path, avoiding repeated decimal conversion in hot numeric upper calls","timestamp":1773451402933,"segment":0}
{"run":40,"commit":"10ded29","metric":23518.55,"metrics":{},"status":"discard","description":"Control rerun after cached small-u64 upper coercion; result remains in ~23.5us range and confirms large win","timestamp":1773451429998,"segment":0}
{"run":41,"commit":"10ded29","metric":23493.49,"metrics":{},"status":"discard","description":"Tried arg-count-aware one-arg upper VM dispatch (call_upper_filter_one) to skip slice arity match on fixed-arity instructions; no improvement","timestamp":1773451528613,"segment":0}
{"run":42,"commit":"5a0fab7","metric":23347.66,"metrics":{},"status":"keep","description":"Tune upper numeric Value cache size from 1024 to 256 entries (covers common small integers with better locality and less initialization overhead)","timestamp":1773451560546,"segment":0}
{"run":43,"commit":"5a0fab7","metric":23364.59,"metrics":{},"status":"discard","description":"Control rerun for 256-entry upper numeric cache confirms stable performance around 23.35us","timestamp":1773451576948,"segment":0}
{"run":44,"commit":"5a0fab7","metric":23979.16,"metrics":{},"status":"discard","description":"Tried shrinking upper numeric cache to 128 entries; misses for common mid-range integers outweighed locality gains","timestamp":1773451607015,"segment":0}
{"run":45,"commit":"5a0fab7","metric":23379.88,"metrics":{},"status":"discard","description":"Tried expanding upper numeric cache to 512 entries; no measurable win versus 256-entry cache","timestamp":1773451636862,"segment":0}
{"run":46,"commit":"5a0fab7","metric":23384.77,"metrics":{},"status":"discard","description":"Tried simplifying cached_u64_value to return Value directly (removing Option/unwrap_or path); no measurable gain","timestamp":1773451711561,"segment":0}
{"run":47,"commit":"62de878","metric":21700.2,"metrics":{},"status":"keep","description":"Add small-integer HTML output fast path in write_with_html_escaping for U64/I64/Bool using cached string formatting, bypassing generic Value display on hot numeric emits","timestamp":1773451780180,"segment":0}
{"run":48,"commit":"62de878","metric":21778.32,"metrics":{},"status":"discard","description":"Control rerun on numeric HTML output fast path confirms stable ~21.7us band","timestamp":1773451807653,"segment":0}
{"run":49,"commit":"62de878","metric":22383.47,"metrics":{},"status":"discard","description":"Tried shrinking small-integer HTML output cache from 256 to 128; misses on mid-range loop indices regressed render","timestamp":1773451862516,"segment":0}
{"run":50,"commit":"62de878","metric":21802.73,"metrics":{},"status":"discard","description":"Tried expanding small-integer HTML output cache from 256 to 512; no measurable improvement","timestamp":1773451893488,"segment":0}
{"type":"config","name":"Optimize MiniJinja render benchmark (multi-workload)","metricName":"render_ns","metricUnit":"ns","bestDirection":"lower"}
{"run":1,"commit":"409a1a5","metric":78718.42,"metrics":{},"status":"keep","description":"Baseline run on multi-workload autoresearch harness (all_elements + string_heavy + macro_heavy) after reinitializing target","timestamp":1773484287607,"segment":2}
{"run":2,"commit":"0dccf2e","metric":73936.85,"metrics":{},"status":"keep","description":"Optimize context! construction by storing static keys as &'static str maps and adding direct Object map support, avoiding per-key Arc<str> allocations across all render workloads","timestamp":1773484518390,"segment":2}
{"run":3,"commit":"0dccf2e","metric":73260.09,"metrics":{},"status":"discard","description":"Control rerun on unchanged static-key context optimization measured lower render_ns (~73.26us); treated as favorable variance until confirmed by additional code-backed gains","timestamp":1773484529557,"segment":2}
{"run":4,"commit":"0dccf2e","metric":0,"metrics":{},"status":"crash","description":"Attempted small-map linear-scan fast path for string-keyed map get_value_by_str; failed to compile due ambiguous AsRef type inference in generic map-key macro","timestamp":1773484703926,"segment":2}
{"run":5,"commit":"0dccf2e","metric":75689.77,"metrics":{},"status":"discard","description":"Tested small-map linear-scan path for string-keyed BTreeMap attribute lookup (len<=8) to avoid tree lookup overhead; regressed multi-workload render time","timestamp":1773484722748,"segment":2}
{"run":6,"commit":"3750e33","metric":73391.6,"metrics":{},"status":"keep","description":"Special-case nested context! values in __context_pair to bypass Value::from_serialize roundtrip for context! subexpressions, reducing nested context conversion overhead","timestamp":1773484785159,"segment":2}
{"run":7,"commit":"3750e33","metric":74781.58,"metrics":{},"status":"discard","description":"Control rerun on nested-context serialization bypass showed higher sample (~74.8us), indicating notable run-to-run noise; keep prior improvement but continue validating","timestamp":1773484796351,"segment":2}
{"run":8,"commit":"8912177","metric":73082.02,"metrics":{},"status":"keep","description":"Optimize Value serialization handle registry with a single-slot fast path plus BTreeMap overflow to reduce insert/remove overhead for common immediate Value roundtrips in context construction","timestamp":1773484886972,"segment":2}
{"run":9,"commit":"8912177","metric":73114.59,"metrics":{},"status":"discard","description":"Control rerun after single-slot Value handle registry optimization stayed in the same ~73.1us band, confirming improvement but no further gain without code changes","timestamp":1773484897165,"segment":2}
{"run":10,"commit":"8912177","metric":73045.57,"metrics":{},"status":"discard","description":"Tried BasicStore single-template fast path in Environment::get to bypass map lookup when only one template is loaded; primary render gain was tiny/noisy and not robust","timestamp":1773484951712,"segment":2}
{"run":11,"commit":"8912177","metric":73004.23,"metrics":{},"status":"discard","description":"Preallocated Output capture stack with capacity 4 to reduce capture push reallocations; observed only tiny/noisy primary change on multi-workload benchmark","timestamp":1773484987245,"segment":2}
