{"run":12,"commit":"13da246","metric":72531.26,"metrics":{},"status":"keep","description":"Replace closure-based internal-serialization OnDrop guard with lightweight dedicated Drop guard to reduce Value::from_serialize guard overhead on hot context construction paths","timestamp":1773485036399,"segment":2}
{"run":13,"commit":"5d57f3d","metric":71331.05,"metrics":{},"status":"keep","description":"Remove now-unused OnDrop utility after switching to dedicated serialization guard, reducing dead code and preserving optimized guard path","timestamp":1773485076632,"segment":2}
{"run":14,"commit":"5d57f3d","metric":71725.59,"metrics":{},"status":"discard","description":"Control rerun on current optimized branch remained in ~71.3-71.7us range, confirming materially improved performance but no additional gain without code changes","timestamp":1773485091312,"segment":2}
{"run":15,"commit":"c1445de","metric":71059.23,"metrics":{},"status":"keep","description":"Streamline Value roundtrip signaling by switching handle transport from tuple-struct marker to direct newtype-struct handling in ValueSerializer, removing per-field tuple machinery on hot from_serialize paths","timestamp":1773485201995,"segment":2}
{"run":16,"commit":"c1445de","metric":71277.34,"metrics":{},"status":"discard","description":"Control rerun on newtype-based Value handle signaling remained in ~71.1-71.3us range, confirming stable improvement without additional code changes","timestamp":1773485212764,"segment":2}
{"run":17,"commit":"c1445de","metric":72249.67,"metrics":{},"status":"discard","description":"Tried single-slot handle id shortcut (fixed handle 0 fast path) to avoid LAST_VALUE_HANDLE increments for common Value roundtrips; unexpectedly regressed render throughput","timestamp":1773485282863,"segment":2}
{"run":18,"commit":"796def7","metric":70973.95,"metrics":{},"status":"keep","description":"Add context! literal fast path in __context_pair to use Value::from directly for literals, bypassing serde-based from_serialize conversion overhead on common literal fields","timestamp":1773485327803,"segment":2}
{"run":19,"commit":"796def7","metric":70825.84,"metrics":{},"status":"discard","description":"Control rerun on literal fast path landed in the same improved ~70.8-71.0us band, indicating stable gains with normal measurement variance","timestamp":1773485339820,"segment":2}
{"run":20,"commit":"796def7","metric":71424.15,"metrics":{},"status":"discard","description":"Tried context! vector-of-context! specialization to build Value sequences directly from nested context! entries; added macro complexity and regressed overall render throughput","timestamp":1773485378356,"segment":2}
{"run":21,"commit":"796def7","metric":72038.41,"metrics":{},"status":"discard","description":"Tried Context::load fast path for frames with empty locals/no loop state to skip map/loop checks; additional branch and is_empty checks regressed multi-workload render","timestamp":1773485448069,"segment":2}
{"run":22,"commit":"796def7","metric":70840.17,"metrics":{},"status":"discard","description":"Retested a narrower context! vec-of-context! specialization (brace form only); result was effectively within noise relative to current best and not a robust improvement","timestamp":1773485523315,"segment":2}
{"run":23,"commit":"796def7","metric":70826.82,"metrics":{},"status":"discard","description":"Control run on current kept optimizations (no code changes) to re-establish variance band; render remained around 70.8us","timestamp":1773485540088,"segment":2}
{"run":24,"commit":"796def7","metric":71891.6,"metrics":{},"status":"discard","description":"Tried one-entry thread-local Arc<str> cache for non-small Value::from(&str) conversions to reuse repeated literal allocations; cache lookup overhead outweighed savings and regressed render","timestamp":1773485649182,"segment":2}
{"run":25,"commit":"796def7","metric":70831.39,"metrics":{},"status":"discard","description":"Resume-session control run on current optimized baseline to re-establish variance before new experiments","timestamp":1773485927176,"segment":2}
{"run":26,"commit":"796def7","metric":70692.71,"metrics":{},"status":"discard","description":"Tried increasing compile-time buffer_size_hint multiplier from 2x to 3x template raw bytes to reduce render-time String growth reallocations; initial sample improved slightly, pending confirmation","timestamp":1773485959530,"segment":2}
{"run":27,"commit":"796def7","metric":71301.43,"metrics":{},"status":"discard","description":"Confirmation run for buffer_size_hint 3x multiplier regressed versus current baseline; treating prior improvement as noise and reverting this tuning","timestamp":1773485973728,"segment":2}
{"run":28,"commit":"796def7","metric":71248.7,"metrics":{},"status":"discard","description":"Tried context! fast path for vec![literal, ...] to build Value sequences directly and bypass serde conversion for literal lists; regressed total render time","timestamp":1773486030361,"segment":2}
{"run":29,"commit":"796def7","metric":72299.48,"metrics":{},"status":"discard","description":"Tried dedicated HandleSerializer for VALUE_HANDLE_MARKER newtype path to avoid transform(value).as_usize handle extraction; added serializer machinery regressed render throughput","timestamp":1773486101587,"segment":2}
{"run":30,"commit":"796def7","metric":72317.38,"metrics":{},"status":"discard","description":"Tried avoiding redundant INTERNAL_SERIALIZATION set(true) when already true in mark_internal_serialization; unexpectedly regressed render throughput","timestamp":1773486161586,"segment":2}
{"run":31,"commit":"796def7","metric":72402.36,"metrics":{},"status":"discard","description":"Tried String->Value conversion via Arc::from(val.into_boxed_str()) for large strings to reuse/move string storage path; regressed render workloads","timestamp":1773486359306,"segment":2}
{"run":32,"commit":"796def7","metric":70877.61,"metrics":{},"status":"discard","description":"Tried forcing inline(always) on Value::from_serialize to reduce call overhead across context construction; no improvement on multi-workload render benchmark","timestamp":1773486394211,"segment":2}
{"run":33,"commit":"796def7","metric":75435.55,"metrics":{},"status":"discard","description":"Refactored context! macro into split no-merge and merge-specific arms to remove empty merge-array branch in common path; unexpectedly caused major render regression","timestamp":1773486473651,"segment":2}
{"run":34,"commit":"796def7","metric":72548.83,"metrics":{},"status":"discard","description":"Tried forcing inline(always) on serializing_for_value thread-local check; did not improve and measured substantial regression","timestamp":1773486516285,"segment":2}
{"run":35,"commit":"796def7","metric":71850.91,"metrics":{},"status":"discard","description":"Tried reducing buffer_size_hint to 1x raw template bytes (next power of two) to cut initial String allocation size; render regressed versus current 2x heuristic","timestamp":1773486552458,"segment":2}
{"run":36,"commit":"796def7","metric":71437.82,"metrics":{},"status":"discard","description":"Tried BasicStore small-map (<=2 templates) linear-scan lookup in Environment::get to reduce BTreeMap lookup overhead for tiny template sets; regressed render","timestamp":1773486604392,"segment":2}
{"run":37,"commit":"796def7","metric":71874.02,"metrics":{},"status":"discard","description":"Added positional-only fast path in Macro::call to skip kwargs BTreeSet bookkeeping when no kwargs are present; minor macro_heavy gain was outweighed by regressions elsewhere","timestamp":1773486672768,"segment":2}
{"run":38,"commit":"796def7","metric":71133.48,"metrics":{},"status":"discard","description":"Tried replacing Value handle registry overflow storage from BTreeMap to small Vec<(u32, Value)> with linear remove/swap_remove for tiny expected cardinality; slightly regressed render","timestamp":1773486742980,"segment":2}
{"run":39,"commit":"04e11e3","metric":70135.42,"metrics":{},"status":"keep","description":"Add ASCII fast path for title filter using byte-wise case conversion and preallocated output, avoiding per-char Unicode formatter writes on common ASCII text","timestamp":1773486803749,"segment":2}
{"run":40,"commit":"04e11e3","metric":69657.89,"metrics":{},"status":"discard","description":"Control rerun after title ASCII fast path stayed in stronger ~69.7-70.1us band, confirming robust improvement across string-heavy and macro-heavy workloads","timestamp":1773486823255,"segment":2}
{"run":41,"commit":"04e11e3","metric":70711.92,"metrics":{},"status":"discard","description":"Tried adding ASCII fast path to lower filter (no-op detection + to_ascii_lowercase); regressed total render due all_elements slowdown despite minor string-heavy gains","timestamp":1773486848518,"segment":2}
{"run":42,"commit":"04e11e3","metric":70565.76,"metrics":{},"status":"discard","description":"Tried changing default filter's optional fallback argument from Option<Value> to Option<&Value> to avoid eager Value cloning in argument marshalling; regressed total render","timestamp":1773486891194,"segment":2}
{"run":43,"commit":"04e11e3","metric":69996.09,"metrics":{},"status":"discard","description":"Added replace filter fast paths for no-op cases (from==to and substring-miss) to avoid unnecessary String replacement work; initial run improved but requires confirmation against variance","timestamp":1773486932318,"segment":2}
{"run":44,"commit":"2206d1f","metric":69626.95,"metrics":{},"status":"keep","description":"Optimize replace filter with no-op fast paths (identical from/to and missing substring) to skip unnecessary allocation-heavy replacement work across string-heavy and macro-heavy templates","timestamp":1773486941325,"segment":2}
{"run":45,"commit":"2206d1f","metric":70267.59,"metrics":{},"status":"discard","description":"Tried single-byte ASCII replace specialization using memchr + in-place byte rewrite for from.len()==to.len()==1; added overhead and regressed render throughput","timestamp":1773487007160,"segment":2}
{"run":46,"commit":"2206d1f","metric":69964.52,"metrics":{},"status":"discard","description":"Tried byte-vector ASCII path for title filter (Vec<u8> + from_utf8_unchecked) to avoid per-char String::push overhead; did not beat existing title fast path","timestamp":1773487047118,"segment":2}
{"run":47,"commit":"2206d1f","metric":70091.16,"metrics":{},"status":"discard","description":"Tried replace precheck tuning with memchr for single-byte patterns instead of generic contains; did not outperform current replace fast-path implementation","timestamp":1773487115276,"segment":2}
{"run":48,"commit":"2206d1f","metric":69934.89,"metrics":{},"status":"discard","description":"Control run on current kept optimizations to re-check variance; render remains in ~69.6-70.0us band","timestamp":1773487140708,"segment":2}
{"run":49,"commit":"2206d1f","metric":69898.44,"metrics":{},"status":"discard","description":"Tried using to_ascii_uppercase for ASCII uppercase conversions when lowercase bytes are present; small improvement signal but within noise band, needs confirmation","timestamp":1773487170434,"segment":2}
{"run":50,"commit":"2206d1f","metric":70455.4,"metrics":{},"status":"discard","description":"Confirmation run for ASCII to_ascii_uppercase path regressed notably (especially macro-heavy), so keeping existing upper implementation","timestamp":1773487182412,"segment":2}
{"run":51,"commit":"2206d1f","metric":70614.58,"metrics":{},"status":"discard","description":"Retuned Context frame-stack initial capacity from 40 to 36 under current multi-workload baseline; regressed render performance","timestamp":1773487222354,"segment":2}
{"run":52,"commit":"2206d1f","metric":69472.33,"metrics":{},"status":"discard","description":"Retuned Context frame-stack initial capacity from 40 to 44; initial run showed strong improvement, pending confirmation","timestamp":1773487249363,"segment":2}
{"run":53,"commit":"2206d1f","metric":69981.12,"metrics":{},"status":"discard","description":"Confirmation run for Context stack capacity 44 regressed back toward/no better than baseline; prior strong sample treated as variance","timestamp":1773487257606,"segment":2}
{"run":54,"commit":"2206d1f","metric":69201.18,"metrics":{},"status":"discard","description":"Retuned Context frame-stack initial capacity from 40 to 42; initial run showed strong improvements across all three render workloads, pending confirmation","timestamp":1773487279265,"segment":2}
{"run":55,"commit":"2206d1f","metric":69943.35,"metrics":{},"status":"discard","description":"Confirmation run for Context stack capacity 42 regressed into existing variance band; not a robust improvement over current baseline","timestamp":1773487293812,"segment":2}
{"run":56,"commit":"2206d1f","metric":69563.48,"metrics":{},"status":"discard","description":"Control run on current kept code after capacity retune attempts; observed lower-noise sample (~69.56us) without code changes","timestamp":1773487316476,"segment":2}
{"run":57,"commit":"2206d1f","metric":69656.9,"metrics":{},"status":"discard","description":"Tried context! vec[...] specialization to build Value sequences directly from per-item from_serialize conversions; result was effectively flat/slightly worse vs current best","timestamp":1773487491978,"segment":2}
{"run":58,"commit":"2206d1f","metric":70788.41,"metrics":{},"status":"discard","description":"Tried replacing Value roundtrip handle registry with simple LIFO stack + unit-struct marker (removing handle generation/map lookup); caused clear multi-workload regression","timestamp":1773487646660,"segment":2}
{"run":59,"commit":"2206d1f","metric":69666.34,"metrics":{},"status":"discard","description":"Tried join filter micro-optimizations (reserve joiner capacity from val.len() and first-flag loop instead of enumerate); effectively flat/slightly worse than current best","timestamp":1773487684238,"segment":2}
{"run":60,"commit":"9ec0b4e","metric":69354.16,"metrics":{},"status":"keep","description":"Tune replace fast path to only run substring-miss precheck for multi-byte patterns; avoids redundant double scans on common single-character replacements while still skipping obvious no-op cases","timestamp":1773487793428,"segment":2}
{"run":61,"commit":"9ec0b4e","metric":71542.65,"metrics":{},"status":"discard","description":"Control rerun after replace precheck tuning produced a high-noise outlier (~71.5us); continuing with further validation of new keep","timestamp":1773487818051,"segment":2}
{"run":62,"commit":"9ec0b4e","metric":72713.88,"metrics":{},"status":"discard","description":"Second control rerun after replace tuning also showed severe machine-load drift; sample treated as outlier and not used to judge code quality","timestamp":1773487837621,"segment":2}
{"run":63,"commit":"9ec0b4e","metric":69920.9,"metrics":{},"status":"discard","description":"Tried tightening replace miss-precheck threshold from pattern length >1 to >2; regressed relative to current replace tuning","timestamp":1773487867555,"segment":2}
{"run":64,"commit":"9ec0b4e","metric":69745.12,"metrics":{},"status":"discard","description":"Tried branch pattern-match delimiter check in title ASCII fast path instead of is_ascii_punctuation/is_ascii_whitespace helpers; regressed render throughput","timestamp":1773487913658,"segment":2}
{"run":65,"commit":"9ec0b4e","metric":74273.77,"metrics":{},"status":"discard","description":"Restored tuple-struct Value roundtrip marker semantics to fix flattening error behavior/tests; primary benchmark regressed heavily under current run conditions","timestamp":1773488048280,"segment":2}
{"type":"config","name":"Optimize MiniJinja parse+compile benchmark (guarding render)","metricName":"parse_compile_ns","metricUnit":"ns","bestDirection":"lower"}
{"run":18,"commit":"1d31b7d","metric":17136.07,"metrics":{},"status":"keep","description":"Cached default auto-escape callbacks and formatter Arcs in Environment::new/empty with OnceLock so each environment clone reuses shared callbacks instead of allocating new Arc trait objects; compile improved to 10293.95ns (parse 6842.12ns) with stable render guardrail 81387.37ns","timestamp":1773499984549,"segment":3}
{"run":27,"commit":"0a5e14a","metric":24077.15,"metrics":{},"status":"discard","description":"Added ASCII fast path in Tokenizer::skip_whitespace with Unicode fallback. Run was heavily contended and produced unusable outlier metrics (parse 10565.10ns, compile 13512.05ns, render 126552.08ns), so discard pending cleaner measurements","timestamp":1773503102968,"segment":3}
{"run":28,"commit":"0a5e14a","metric":40168.29,"metrics":{},"status":"discard","description":"Second post-change control run remained severely saturated (parse 17512.04ns, compile 22656.25ns, render 208615.89ns), confirming host contention is dominating measurements","timestamp":1773503138756,"segment":3}
{"run":29,"commit":"0a5e14a","metric":52576.02,"metrics":{},"status":"discard","description":"Tried reverting parse_args preallocation to Vec::new to reduce empty-call allocations. Host was extremely contended (run 35.7s; parse 25045.09ns, compile 27530.93ns, render 228207.69ns), so sample is unusable and discarded","timestamp":1773503211794,"segment":3}
{"run":30,"commit":"0a5e14a","metric":18931.48,"metrics":{},"status":"discard","description":"Control run immediately after killing a long-lived rogue autoresearch_render background process; metrics improved from extreme saturation but remained elevated (parse 8239.75ns, compile 10691.73ns, render 168709.31ns), so treated as transitional noise","timestamp":1773503322252,"segment":3}
{"run":31,"commit":"0a5e14a","metric":32462.56,"metrics":{},"status":"discard","description":"Follow-up control remained highly unstable even without rogue benchmark processes (parse 14136.72ns, compile 18325.84ns, render 192068.36ns), so still unusable as optimization signal","timestamp":1773503339171,"segment":3}
{"run":32,"commit":"0a5e14a","metric":13433.44,"metrics":{},"status":"discard","description":"Cached last recorded line/span in Instructions to avoid Vec::last checks in add_with_line/add_with_span. This run showed a huge improvement (parse 5861.82ns, compile 7571.62ns, render 68945.65ns), but coincided with a major host-load shift; discarding until A/B confirmed","timestamp":1773503427291,"segment":3}
{"run":33,"commit":"0a5e14a","metric":13796.38,"metrics":{},"status":"discard","description":"Second run of cached-last-line/span Instructions change remained in the same strong band (parse 6030.76ns, compile 7765.62ns, render 71068.36ns), suggesting improvement may be real; still pending baseline A/B under same load","timestamp":1773503440319,"segment":3}
{"run":34,"commit":"0a5e14a","metric":13500.33,"metrics":{},"status":"discard","description":"A/B baseline rerun on unmodified Instructions (after reverting cached-last-line/span patch) measured parse 5906.25ns and compile 7594.08ns, essentially matching or slightly beating patched runs; treating the patch as non-beneficial","timestamp":1773503461809,"segment":3}
{"run":35,"commit":"0a5e14a","metric":13587.4,"metrics":{},"status":"discard","description":"Retuned codegen instruction buffer preallocation from 256 to 224 entries; compile regressed slightly to 7673.83ns (parse 5913.57ns), so 256 remains better","timestamp":1773503486429,"segment":3}
{"run":36,"commit":"0a5e14a","metric":13194.02,"metrics":{},"status":"discard","description":"Changed parser call-argument vector initialization from Vec::with_capacity(4) to Vec::new to avoid eager allocations for zero-arg calls; first run improved to parse 5807.62ns and compile 7386.40ns, pending confirmation","timestamp":1773503516663,"segment":3}
{"run":37,"commit":"0a5e14a","metric":13442.71,"metrics":{},"status":"discard","description":"Confirmation run for parse_args Vec::new remained better on parse (5849.61ns) but compile returned to baseline (7593.10ns); net gain shrank to a small/noisy ~0.4%, so not yet keep-worthy","timestamp":1773503527945,"segment":3}
{"run":38,"commit":"8c1fd27","metric":13416.83,"metrics":{},"status":"keep","description":"Use Vec::new for parse_args instead of eager Vec::with_capacity(4), avoiding unnecessary allocations for common zero-arg calls; repeated runs stabilized around parse ~5.82µs with compile ~7.60µs (this run 5818.85ns + 7597.98ns) and no render regression","timestamp":1773503545978,"segment":3}
{"run":39,"commit":"8c1fd27","metric":13325.85,"metrics":{},"status":"discard","description":"Retuned parser subparse statement vector capacity from 16 to 8 to reduce over-allocation in many small nested blocks; first run improved to parse 5884.77ns and compile 7441.08ns, pending confirmation","timestamp":1773503587372,"segment":3}
{"run":40,"commit":"8c1fd27","metric":36019.54,"metrics":{},"status":"discard","description":"Second run for subparse capacity 8 was a severe contention outlier (parse 17553.39ns, compile 18466.15ns, render 168690.44ns); cannot use for decision","timestamp":1773503599264,"segment":3}
{"run":41,"commit":"8c1fd27","metric":13698.57,"metrics":{},"status":"discard","description":"Third run for subparse capacity 8 under normal load regressed (parse 5928.06ns, compile 7770.51ns), so keeping subparse capacity 16","timestamp":1773503619592,"segment":3}
{"run":42,"commit":"8c1fd27","metric":13198.25,"metrics":{},"status":"discard","description":"Retuned parse_with_block assignment vector capacity from 4 to 2 to better match typical small assignment counts; first run improved parse to 5757.16ns and compile to 7441.09ns, pending confirmation","timestamp":1773503643486,"segment":3}
{"run":43,"commit":"8c1fd27","metric":13234.87,"metrics":{},"status":"discard","description":"Second run for parse_with_block capacity 2 remained in improved band (parse 5732.59ns, compile 7502.28ns, render 69215.50ns), running one more validation before keeping","timestamp":1773503652702,"segment":3}
