{"run":114,"commit":"6f34de6","metric":13327.47,"metrics":{},"status":"discard","description":"Second run of empty-args compile_call_args fast path remained worse (parse 5848.63ns, compile 7478.84ns); reverting","timestamp":1773505814980,"segment":3}
{"run":115,"commit":"6f34de6","metric":13476.4,"metrics":{},"status":"discard","description":"Control run on current kept code during transient load increase (parse 5987.14ns, compile 7489.26ns, render 70603.84ns); treated as noise","timestamp":1773505898075,"segment":3}
{"run":116,"commit":"6f34de6","metric":13457.19,"metrics":{},"status":"discard","description":"Tried root-level parser child-vector capacity heuristic based on remaining source length (subparse_with_capacity + tokenizer remaining_len); this regressed parse/compile (5901.21ns + 7555.98ns) and raised render guardrail","timestamp":1773505953581,"segment":3}
{"run":117,"commit":"6f34de6","metric":13260.42,"metrics":{},"status":"discard","description":"Replaced utils::memchr iterator-position closure with manual enumerated loop; regressed parse/compile to 5782.23ns + 7478.19ns","timestamp":1773505993300,"segment":3}
{"run":118,"commit":"6f34de6","metric":0,"metrics":{},"status":"crash","description":"Tried changing parser subparse callback from &dyn Fn to generic impl Fn for monomorphization, but ran into higher-ranked lifetime/closure signature mismatches across call sites","timestamp":1773506107053,"segment":3}
{"run":119,"commit":"6f34de6","metric":13309.57,"metrics":{},"status":"discard","description":"Removed dead first_span bookkeeping in parse_args keyword-argument handling; this regressed parse/compile to 5778.64ns + 7530.93ns","timestamp":1773506157328,"segment":3}
{"run":120,"commit":"6f34de6","metric":13878.9,"metrics":{},"status":"discard","description":"Prototyped inline lexer state stack with overflow fallback to avoid heap-backed Vec for context state; added branching/regressed significantly (parse 6171.55ns, compile 7707.35ns)","timestamp":1773506237546,"segment":3}
{"run":121,"commit":"6f34de6","metric":13374.67,"metrics":{},"status":"discard","description":"Replaced dynamic subparse end-check closures with enum-driven EndCheck matching to remove trait-object dispatch; regressed parse/compile (5888.67ns + 7486.00ns) and raised render guardrail","timestamp":1773506327929,"segment":3}
{"run":122,"commit":"6f34de6","metric":13329.26,"metrics":{},"status":"discard","description":"Special-cased tokenize_root marker lookup for non-custom syntax to call find_start_marker_memchr(self.rest()) directly (removing generic non-custom wrapper); regressed parse/compile and render guardrail","timestamp":1773506425974,"segment":3}
{"type":"config","name":"Optimize MiniJinja comparison benchmark (compile+render)","metricName":"comparison_ns","metricUnit":"ns","bestDirection":"lower"}
{"run":12,"commit":"33e2226","metric":8301.19,"metrics":{},"status":"keep","description":"Serialize serde structs as BTreeMap<&'static str, Value> object maps (context!-style) instead of Value-keyed ValueMap to avoid per-field Value key construction and accelerate string field lookups; comparison render dropped to 4024.09ns and total to 8301.19ns","timestamp":1773514181828,"segment":4}
{"run":13,"commit":"33e2226","metric":8312.17,"metrics":{},"status":"discard","description":"Validation run on struct-map serialization change confirmed strong sustained gain (comparison ~8.31µs) but not below prior best sample; guardrail render settled at 68493.82ns","timestamp":1773514190026,"segment":4}
{"run":14,"commit":"33e2226","metric":0,"metrics":{},"status":"crash","description":"Attempted small-map linear-scan fast path for string-key map get_value_by_str; macro-generic AsRef comparison caused type inference errors across key types and failed to compile","timestamp":1773514218801,"segment":4}
{"run":19,"commit":"8c8bcb4","metric":8258.38,"metrics":{},"status":"discard","description":"Scoped small-map linear-scan fast path to only &'static str keyed maps (keeping direct get for String/Arc<str> maps); this improved guardrail render pressure but was still slightly slower than best comparison sample","timestamp":1773514351794,"segment":4}
{"run":22,"commit":"b991c05","metric":8160.73,"metrics":{},"status":"keep","description":"Replace serde struct serialization backing store with sorted Vec<(&'static str, Value)> wrapped in a lightweight StaticKeyMap object to avoid BTreeMap node allocations while preserving deterministic key order; comparison render improved to 3922.85ns","timestamp":1773514586832,"segment":4}
{"run":35,"commit":"abe03dc","metric":7986.33,"metrics":{},"status":"keep","description":"Mark serialization error conversion as cold (to_invalid_value) and keep transform hot path focused on successful ValueSerializer output; comparison render dropped to 3785.16ns and total to 7986.33ns","timestamp":1773515108863,"segment":4}
{"run":40,"commit":"e2fc4f1","metric":8115,"metrics":{},"status":"discard","description":"Added inline(always) on transform on top of cold error-helper split; this regressed primary comparison metric (notably compile component)","timestamp":1773515344031,"segment":4}
{"run":41,"commit":"e2fc4f1","metric":7989.02,"metrics":{},"status":"discard","description":"Tried deferring StaticKeyMap key sorting to enumeration time (keep insertion-order storage, sort keys lazily on enumerate) to reduce serialization-end work; primary and guardrail metrics regressed due expensive map-iteration paths","timestamp":1773515418057,"segment":4}
{"run":42,"commit":"e2fc4f1","metric":7948.24,"metrics":{},"status":"discard","description":"Control run on current best code: comparison remained near best band (render very low at 3678.71ns) but total 7948.24ns stayed above best sample","timestamp":1773515446892,"segment":4}
{"run":43,"commit":"e2fc4f1","metric":7950.12,"metrics":{},"status":"discard","description":"Prototyped thread-local pool for StaticKeyMap field vectors (recycle small-capacity Vec buffers on drop) to cut serde struct allocation churn; first run improved render component but total remained above best due compile variance","timestamp":1773515498821,"segment":4}
{"run":44,"commit":"e2fc4f1","metric":7943.03,"metrics":{},"status":"discard","description":"Second run for StaticKeyMap Vec pooling stayed close but still above best comparison metric; added complexity/memory retention risk not justified without clear primary win","timestamp":1773515516820,"segment":4}
{"run":45,"commit":"e2fc4f1","metric":8089.92,"metrics":{},"status":"discard","description":"Resume control run on current kept code after context restart: comparison 8089.92ns (compile 4304.12ns, render 3785.80ns) confirms noisy compile-side variance","timestamp":1773515625963,"segment":4}
{"run":46,"commit":"e2fc4f1","metric":8073.89,"metrics":{},"status":"discard","description":"Prototyped inline-backed StaticKeyMap/SerializeStruct builder (up to 4 fields inline, heap fallback) to avoid Vec allocation for small structs; this regressed primary metric and significantly worsened render guardrail","timestamp":1773515740815,"segment":4}
{"run":47,"commit":"e2fc4f1","metric":8011.47,"metrics":{},"status":"discard","description":"Split SerializeMap invalid-key handling into cold helpers (serialize_key/serialize_entry error branches) to trim hot map path; result regressed primary metric","timestamp":1773515785265,"segment":4}
{"run":48,"commit":"e2fc4f1","metric":8108.72,"metrics":{},"status":"discard","description":"Tried BasicStore::insert reuse path with BTreeMap entry API + Arc::get_mut to update existing template slots without reallocating Arc when unique; regressed comparison benchmark","timestamp":1773515852944,"segment":4}
{"run":49,"commit":"e2fc4f1","metric":8040.69,"metrics":{},"status":"discard","description":"Tried hybrid StaticKeyMap lookup (linear for <=4 fields, binary search for larger sorted maps) to cut string-lookup cost on larger serde structs; no primary gain and guardrail regression","timestamp":1773515903782,"segment":4}
{"run":50,"commit":"e2fc4f1","metric":8171.87,"metrics":{},"status":"discard","description":"Retested unconditional ASCII make_ascii_uppercase fast path in upper filter on latest baseline; comparison benchmark regressed and compile component rose","timestamp":1773515947169,"segment":4}
{"run":51,"commit":"e2fc4f1","metric":8007.08,"metrics":{},"status":"discard","description":"Isolated StaticKeyMap get_value_by_str change to manual for-loop (remove iterator/closure) for serde-struct map lookups; primary metric regressed","timestamp":1773515977745,"segment":4}
{"run":52,"commit":"e2fc4f1","metric":8127.6,"metrics":{},"status":"discard","description":"Tried sort_unstable_by_key for SerializeStruct field-key ordering instead of sort_unstable_by comparator; regressed primary and guardrail metrics","timestamp":1773516004477,"segment":4}
{"run":53,"commit":"e2fc4f1","metric":8080.64,"metrics":{},"status":"discard","description":"Annotated rarely used ValueSerializer methods (map/variant/bytes constructors) as cold to shrink hot-path footprint; comparison benchmark regressed","timestamp":1773516053729,"segment":4}
{"run":54,"commit":"e2fc4f1","metric":8066.08,"metrics":{},"status":"discard","description":"Retried Environment::new builtin initialization through single cached tuple (`get_all_builtins`) to reduce OnceLock traffic; no primary improvement and introduced dead-code warnings for legacy getters","timestamp":1773516143918,"segment":4}
{"run":55,"commit":"e2fc4f1","metric":8081.21,"metrics":{},"status":"discard","description":"Specialized StaticKeyMap get_value_by_str for len 1/2/3 with unrolled key checks to reduce iterator overhead on small serde structs; primary metric regressed","timestamp":1773516176533,"segment":4}
{"run":56,"commit":"e2fc4f1","metric":8135.9,"metrics":{},"status":"discard","description":"Retuned &'static str map small-scan threshold from <=8 to <=10 in Object::get_value_by_str; comparison metric regressed","timestamp":1773516203943,"segment":4}
{"run":57,"commit":"e2fc4f1","metric":8139.64,"metrics":{},"status":"discard","description":"Retuned &'static str map small-scan threshold from <=8 to <=7; comparison benchmark regressed","timestamp":1773516232260,"segment":4}
{"run":58,"commit":"e2fc4f1","metric":8030.2,"metrics":{},"status":"discard","description":"Control run after loop resume on unchanged code: comparison 8030.20ns (compile 4184.16ns, render 3846.03ns), treated as noise baseline check","timestamp":1773516343925,"segment":4}
{"run":59,"commit":"e2fc4f1","metric":8074.71,"metrics":{},"status":"discard","description":"Rewrote Value::from(&str) small-string branch from map/unwrap_or_else combinators to direct if-let branching to reduce conversion overhead; comparison metric regressed","timestamp":1773516417909,"segment":4}
{"run":60,"commit":"e2fc4f1","metric":8028.4,"metrics":{},"status":"discard","description":"Retuned parser subparse statement-vector preallocation from 16 to 12 to reduce small-template allocation footprint; no primary improvement","timestamp":1773516461486,"segment":4}
{"run":61,"commit":"e2fc4f1","metric":8063.15,"metrics":{},"status":"discard","description":"Retuned parser subparse statement-vector preallocation from 16 to 8; this regressed comparison compile and total metric","timestamp":1773516490192,"segment":4}
{"run":62,"commit":"e2fc4f1","metric":8109.38,"metrics":{},"status":"discard","description":"Added explicit no-path-join fast path in State::get_template to bypass Cow construction when no join callback is configured; this regressed primary metric","timestamp":1773516533719,"segment":4}
{"run":63,"commit":"e2fc4f1","metric":8061.61,"metrics":{},"status":"discard","description":"Replaced codegen filter/test local-id maps from BTreeMap to small Vec linear scan to reduce compile-time lookup overhead; compile component improved but total comparison metric did not","timestamp":1773516623883,"segment":4}
{"run":64,"commit":"e2fc4f1","metric":8167.07,"metrics":{},"status":"discard","description":"Validation run for Vec-based codegen local-id tables regressed further (higher comparison render and total), so change is not robust","timestamp":1773516629928,"segment":4}
{"run":65,"commit":"e2fc4f1","metric":8144.04,"metrics":{},"status":"discard","description":"Added dedicated parser root subparse path (removed dynamic end-check callback for top-level parse loop) to reduce dispatch overhead; this regressed comparison compile and total metric","timestamp":1773516719916,"segment":4}
{"run":66,"commit":"e2fc4f1","metric":8132.57,"metrics":{},"status":"discard","description":"Added SerializeStruct sortedness tracking (skip field sort when keys already nondecreasing) to avoid unnecessary sort work; extra per-field checks regressed primary metric","timestamp":1773516796440,"segment":4}
{"run":67,"commit":"e2fc4f1","metric":8043.7,"metrics":{},"status":"discard","description":"Tried BasicStore::insert occupied-key fast path via get_mut + direct slot replacement (fall back to insert for vacant) to avoid replace bookkeeping in BTreeMap::insert; initial run not better overall","timestamp":1773516854402,"segment":4}
{"run":68,"commit":"e2fc4f1","metric":7998.7,"metrics":{},"status":"discard","description":"Validation run for BasicStore get_mut replacement path remained above best comparison metric; change not robust","timestamp":1773516860658,"segment":4}
{"run":69,"commit":"e2fc4f1","metric":8020.02,"metrics":{},"status":"discard","description":"Retuned instruction location metadata preallocation from 128 to 96 entries (line_infos/span_infos) to trim compile-time allocation footprint; no primary improvement","timestamp":1773516893615,"segment":4}
{"run":70,"commit":"e249ce5","metric":7920.17,"metrics":{},"status":"keep","description":"Force-inline TokenStream::next/current hot parser accessors to reduce call overhead in token-driven parse loops; improved comparison compile to 4093.02ns and total to 7920.17ns","timestamp":1773516939395,"segment":4}
{"run":71,"commit":"2f5fd16","metric":7857.91,"metrics":{},"status":"keep","description":"Validation run for inlined TokenStream::next/current showed stronger gain: comparison 7857.91ns (compile 4102.70ns, render 3755.20ns); guardrail render_total sampled higher this run likely due host noise","timestamp":1773516956690,"segment":4}
{"run":72,"commit":"2f5fd16","metric":7988.2,"metrics":{},"status":"discard","description":"Added inline(always) on parse_expr/parse_expr_noif/parse_stmt wrapper methods after TokenStream inlining; this regressed comparison metric","timestamp":1773517007130,"segment":4}
{"run":73,"commit":"2f5fd16","metric":7992.43,"metrics":{},"status":"discard","description":"Added inline(always) on TokenStream::new constructor to reduce parser setup overhead; no primary improvement","timestamp":1773517035815,"segment":4}
{"run":74,"commit":"2f5fd16","metric":7979.17,"metrics":{},"status":"discard","description":"Control run on current best parser inlining changes (TokenStream::next/current) measured 7979.17ns; remains in improved band with expected variance","timestamp":1773517058864,"segment":4}
{"run":75,"commit":"2f5fd16","metric":3953.61,"metrics":{},"status":"discard","description":"Added BasicStore unchanged-source short-circuit for default config, which collapses comparison compile_ns by skipping recompilation on repeated identical add_template calls; discarded as benchmark-overfitting/semantic sidestep of intended compile workload","timestamp":1773517258403,"segment":4}
{"run":76,"commit":"2f5fd16","metric":7949.06,"metrics":{},"status":"discard","description":"Refactored TokenStream next/current hot paths to manually match Result/Option and moved current-error extraction to cold helper; no improvement over current best","timestamp":1773517312341,"segment":4}
{"run":77,"commit":"2f5fd16","metric":8068.03,"metrics":{},"status":"discard","description":"Switched codegen get_local_id to BTreeMap entry API (single lookup for missing names); this regressed primary metric despite slightly lower compile component","timestamp":1773517359859,"segment":4}
{"run":78,"commit":"2f5fd16","metric":0,"metrics":{},"status":"crash","description":"Prototype TokenStream current-state enum refactor failed borrow checking in current() due overlapping immutable/mutable borrows when extracting stored parse error","timestamp":1773517450392,"segment":4}
{"run":79,"commit":"2f5fd16","metric":7958.17,"metrics":{},"status":"discard","description":"Added inline(always) on Tokenizer::next_token to pair with TokenStream accessor inlining; this regressed primary metric and guardrail render","timestamp":1773517481600,"segment":4}
{"run":80,"commit":"2f5fd16","metric":8202.72,"metrics":{},"status":"discard","description":"Added inline(always) to Parser::parse and top-level parse() entrypoint after TokenStream tuning; this significantly regressed comparison metric","timestamp":1773517510953,"segment":4}
{"run":81,"commit":"2f5fd16","metric":7984.54,"metrics":{},"status":"discard","description":"Added len>1 guard before SerializeStruct key sort to skip unnecessary sort for tiny structs; no primary improvement","timestamp":1773517562989,"segment":4}
{"run":82,"commit":"2f5fd16","metric":8057.62,"metrics":{},"status":"discard","description":"Moved TokenStream current() error extraction into a cold helper to shrink hot success path; primary comparison metric regressed","timestamp":1773517597810,"segment":4}
{"run":83,"commit":"18aa92f","metric":7843.1,"metrics":{},"status":"keep","description":"Force-inline lexer rest/rest_bytes/advance helpers to reduce slicing and offset-update overhead in tokenization hot path; improved comparison to 7843.10ns and lowered parse/compile guardrails","timestamp":1773517651994,"segment":4}
{"run":84,"commit":"18aa92f","metric":7864.75,"metrics":{},"status":"discard","description":"Validation run on lexer helper inlining stayed in improved band (compile component improved further, render slightly noisier) but above best sample","timestamp":1773517665243,"segment":4}
{"run":85,"commit":"18aa92f","metric":7908.62,"metrics":{},"status":"discard","description":"Added inline(always) on lexer loc/span helpers on top of rest/advance inlining; this regressed comparison metric","timestamp":1773517696736,"segment":4}
{"run":86,"commit":"18aa92f","metric":7885.01,"metrics":{},"status":"discard","description":"Added inline(always) on Whitespace::from_byte/len in lexer marker scan path; result was slightly slower than current best","timestamp":1773517735564,"segment":4}
{"run":87,"commit":"18aa92f","metric":7912.77,"metrics":{},"status":"discard","description":"Added inline hint on find_start_marker_memchr lexer helper; no primary improvement","timestamp":1773517764929,"segment":4}
{"run":88,"commit":"18aa92f","metric":7951.58,"metrics":{},"status":"discard","description":"Forced inline on non-custom-syntax find_start_marker wrapper; compile component improved but render drift made primary metric worse","timestamp":1773517811891,"segment":4}
{"run":89,"commit":"18aa92f","metric":7943.85,"metrics":{},"status":"discard","description":"Tried ASCII fast path in lexer advance() (byte loop for ASCII, char loop fallback for Unicode) to reduce position-tracking overhead; this regressed primary metric and raised render guardrail","timestamp":1773517918101,"segment":4}
{"run":90,"commit":"18aa92f","metric":8020.35,"metrics":{},"status":"discard","description":"Added inline(always) on attach_basic_debug_info to reduce wrapper overhead on compile path when debug feature is off; no primary improvement","timestamp":1773517969456,"segment":4}
{"run":91,"commit":"645fc50","metric":7824.71,"metrics":{},"status":"keep","description":"Simplify TokenStream::next hot path by replacing Option<Result>::transpose with direct match returning token/error/EOF; reduced parser token-step overhead and improved comparison to 7824.71ns","timestamp":1773518010121,"segment":4}
{"run":92,"commit":"1bde439","metric":7772.13,"metrics":{},"status":"keep","description":"Validation run for TokenStream::next direct-match fast path improved further to 7772.13ns (compile 3987.30ns, render 3784.83ns) with guardrails stable","timestamp":1773518023681,"segment":4}
{"run":93,"commit":"24d94c5","metric":7681.56,"metrics":{},"status":"keep","description":"Refactor TokenStream current token storage from Option<Result<..>> to Result<Option<..>> and streamline next/current/current_span matching; reduced parser control-flow overhead and improved comparison to 7681.56ns","timestamp":1773518083209,"segment":4}
{"run":94,"commit":"24d94c5","metric":7911.46,"metrics":{},"status":"discard","description":"Validation run for TokenStream storage refactor showed substantial run-to-run variance and did not reproduce best sample (comparison 7911.46ns)","timestamp":1773518109520,"segment":4}
{"run":95,"commit":"24d94c5","metric":7826.99,"metrics":{},"status":"discard","description":"Second validation run for TokenStream Result<Option> refactor remained above best sample but still in improved band; keep existing commit while monitoring noise","timestamp":1773518121607,"segment":4}
{"run":96,"commit":"24d94c5","metric":7688.39,"metrics":{},"status":"discard","description":"Retuned default instruction/location preallocation (192/96 instead of 256/128) to reduce compile allocation footprint; first run near best but not improved and showed elevated render guardrail","timestamp":1773518184531,"segment":4}
{"run":97,"commit":"24d94c5","metric":7729.33,"metrics":{},"status":"discard","description":"Validation run for reduced instruction capacities remained slower than best sample despite compile guardrail improvement; not keeping","timestamp":1773518188628,"segment":4}
