{"run":44,"commit":"8213759","metric":13252.45,"metrics":{},"status":"keep","description":"Reduce parse_with_block assignment Vec preallocation from 4 to 2, matching common small assignment counts and cutting parser allocation overhead; validated across multiple runs with parse ~5.74-5.76µs and compile ~7.44-7.50µs (this run 5762.86ns + 7489.59ns) without render regression","timestamp":1773503667054,"segment":3}
{"run":45,"commit":"8213759","metric":13430.02,"metrics":{},"status":"discard","description":"Retuned parse_assignment tuple target buffer from capacity 2 to 1; this increased parse/compile to 5866.54ns + 7563.48ns, so capacity 2 remains better","timestamp":1773503692318,"segment":3}
{"run":46,"commit":"8213759","metric":13287.43,"metrics":{},"status":"discard","description":"Retuned parser subparse statement Vec capacity from 16 to 12; compile improved slightly (7396.48ns) but parse regressed (5890.95ns), net parse+compile was effectively flat/slightly worse","timestamp":1773503715290,"segment":3}
{"run":47,"commit":"8213759","metric":13271.16,"metrics":{},"status":"discard","description":"Further retuned parse_with_block assignment capacity from 2 to 1; parse improved slightly but compile worsened (7471.68ns), leaving total parse+compile effectively unchanged/slightly worse","timestamp":1773503737612,"segment":3}
{"run":48,"commit":"8213759","metric":13690.1,"metrics":{},"status":"discard","description":"Added Tokenizer::advance fast paths for 1-byte advances and ASCII no-newline slices to avoid per-char loops; this regressed parse/compile to 5949.87ns + 7740.23ns, so reverted","timestamp":1773503795687,"segment":3}
{"run":49,"commit":"8213759","metric":13317.05,"metrics":{},"status":"discard","description":"Refactored TokenStream to store lookahead token and pending error in separate fields (Option<Token> + Option<Error>) instead of Option<Result<...>> to reduce hot-path matching overhead; first run was roughly flat/slightly worse overall (parse 5904.62ns, compile 7412.43ns) pending confirmation","timestamp":1773503851150,"segment":3}
{"run":50,"commit":"8213759","metric":13728.02,"metrics":{},"status":"discard","description":"Confirmation run for TokenStream pending-error refactor regressed clearly (parse 6077.31ns, compile 7650.71ns, render 71991.87ns), so reverting","timestamp":1773503862606,"segment":3}
{"run":51,"commit":"8213759","metric":13693.36,"metrics":{},"status":"discard","description":"Re-tested codegen filter/test local-id cache as small Vec linear lookup instead of BTreeMap; regressed parse/compile (6095.70ns + 7597.66ns), so keep BTreeMap approach","timestamp":1773503896339,"segment":3}
{"run":52,"commit":"8213759","metric":13258.14,"metrics":{},"status":"discard","description":"Interned default syntax delimiters behind OnceLock (reuse Arc<Delims> in SyntaxConfig::default and builder) to avoid per-default Arc allocation; first run was essentially flat/slightly worse (parse 5721.68ns, compile 7536.46ns) pending confirmation","timestamp":1773503936747,"segment":3}
{"run":53,"commit":"8213759","metric":13120.92,"metrics":{},"status":"discard","description":"Second run for default-delimiter Arc interning improved to parse 5730.30ns and compile 7390.62ns (parse+compile 13120.92ns); signal looks promising but needs another run to separate from variance","timestamp":1773503945837,"segment":3}
{"run":54,"commit":"4040c73","metric":13043.63,"metrics":{},"status":"keep","description":"Intern default SyntaxConfig delimiters with OnceLock and reuse Arc<Delims> in SyntaxConfig::default/builder instead of allocating new Arcs each time; validated over multiple runs with parse ~5.69-5.73µs and compile ~7.35-7.39µs (this run 5693.04ns + 7350.59ns) and stable render guardrail","timestamp":1773503956090,"segment":3}
{"run":55,"commit":"4040c73","metric":13367.35,"metrics":{},"status":"discard","description":"Tried branch-ordered default_auto_escape_callback rewrite (explicit suffix checks + rsplit_once) to reduce string-matching overhead on template registration; regressed to parse 5846.84ns and compile 7520.51ns with higher render guardrail","timestamp":1773504010976,"segment":3}
{"run":56,"commit":"4040c73","metric":13615.89,"metrics":{},"status":"discard","description":"Tried using str::find('{') in lexer start-marker scan instead of byte memchr helper; parse/compile regressed (5989.91ns + 7625.98ns) and left utils::memchr unused, so reverting","timestamp":1773504062059,"segment":3}
{"run":57,"commit":"4040c73","metric":13464.2,"metrics":{},"status":"discard","description":"Re-tested caching default/empty TemplateConfig behind OnceLock in Environment::new/empty; regressed parse+compile to 5847.01ns + 7617.19ns, so per-call TemplateConfig::new remains faster","timestamp":1773504094853,"segment":3}
{"run":58,"commit":"4040c73","metric":13577.63,"metrics":{},"status":"discard","description":"Added conditional gate to avoid calling should_lstrip_block when lstrip logic cannot apply; this increased compile time (7723.30ns) and regressed total parse+compile","timestamp":1773504132106,"segment":3}
{"run":59,"commit":"4040c73","metric":13348.31,"metrics":{},"status":"discard","description":"Split parser subparse capacities (top-level 16, nested 8) to reduce over-allocation in nested bodies while keeping root capacity; net parse+compile regressed slightly (5796.88ns + 7551.43ns)","timestamp":1773504182687,"segment":3}
{"run":60,"commit":"4040c73","metric":12972.82,"metrics":{},"status":"discard","description":"Reduced initial line/span info vector capacities in Instructions::new from 128 to 64 to cut compile-time allocation overhead; first run improved to parse 5670.09ns and compile 7302.73ns, pending confirmation","timestamp":1773504208983,"segment":3}
{"run":61,"commit":"4040c73","metric":13320.63,"metrics":{},"status":"discard","description":"Second run for line/span capacity 64 regressed markedly (parse 5872.72ns, compile 7447.91ns), so initial improvement signal appears unstable","timestamp":1773504218976,"segment":3}
{"run":62,"commit":"4040c73","metric":13422.85,"metrics":{},"status":"discard","description":"Third run for line/span capacity 64 remained worse (parse 5782.55ns, compile 7640.30ns); keeping existing 128 capacities","timestamp":1773504232729,"segment":3}
{"run":63,"commit":"4040c73","metric":13070.14,"metrics":{},"status":"discard","description":"Retuned instruction buffer preallocation from 256 to 272 entries; first run was nearly flat/slightly worse (parse 5707.19ns, compile 7362.95ns), pending quick validation","timestamp":1773504258446,"segment":3}
{"run":64,"commit":"4040c73","metric":12968.9,"metrics":{},"status":"discard","description":"Second run for instruction capacity 272 improved to parse 5736.16ns and compile 7232.74ns (12968.90ns total); running one more validation to determine if this is robust","timestamp":1773504272869,"segment":3}
{"run":65,"commit":"4040c73","metric":13206.87,"metrics":{},"status":"discard","description":"Third validation for instruction capacity 272 regressed (parse 5797.04ns, compile 7409.83ns), so keeping instruction capacity at 256","timestamp":1773504282012,"segment":3}
{"run":66,"commit":"4040c73","metric":13210.61,"metrics":{},"status":"discard","description":"Control run on current kept code to re-establish variance band: parse 5727.54ns, compile 7483.07ns, render 68522.46ns","timestamp":1773504304131,"segment":3}
{"run":67,"commit":"4040c73","metric":13288.08,"metrics":{},"status":"discard","description":"Cached current active span in CodeGenerator to avoid span_stack.last() lookup in add/push/pop paths; this regressed parse+compile slightly (5897.46ns + 7390.62ns)","timestamp":1773504359490,"segment":3}
{"run":68,"commit":"4040c73","metric":13059.25,"metrics":{},"status":"discard","description":"Re-tested parser block-duplicate tracking with small Vec instead of BTreeSet; first run was nearly flat (parse 5660.81ns improved, compile 7398.44ns worsened) and needs confirmation","timestamp":1773504390788,"segment":3}
{"run":69,"commit":"4040c73","metric":13193.04,"metrics":{},"status":"discard","description":"Confirmation run for Vec-based block tracking regressed to parse 5760.09ns and compile 7432.95ns; keep existing BTreeSet implementation","timestamp":1773504398690,"segment":3}
{"run":70,"commit":"4040c73","metric":0,"metrics":{},"status":"crash","description":"Changed parser::parse signature to take &SyntaxConfig, but first benchmark build failed because autoresearch harness still passed SyntaxConfig by value","timestamp":1773504482379,"segment":3}
{"run":71,"commit":"4040c73","metric":13290.53,"metrics":{},"status":"discard","description":"After fixing call sites for parse(&SyntaxConfig), avoiding one syntax_config clone in CompiledTemplate path regressed to parse 5791.83ns and compile 7498.70ns; no benefit","timestamp":1773504488174,"segment":3}
{"run":72,"commit":"4040c73","metric":13102.05,"metrics":{},"status":"discard","description":"Re-applied non-loader BasicStore single-template fast path for fresh A/B under current conditions. Compile improved strongly to 7253.91ns (parse 5848.14ns), but render guardrail increased to 71362.63ns; validating whether render hit is consistent","timestamp":1773504544447,"segment":3}
{"run":73,"commit":"4040c73","metric":12958.98,"metrics":{},"status":"discard","description":"Second validation of BasicStore single-template path stayed strongly improved on primary (parse 5779.62ns, compile 7179.36ns) but render guardrail remained elevated at 70782.56ns (~3%+ above control band)","timestamp":1773504556296,"segment":3}
{"run":74,"commit":"4040c73","metric":13269.86,"metrics":{},"status":"discard","description":"Third validation for BasicStore single-template fast path kept render elevated (71163.08ns) while primary gains fluctuated (5898.77ns parse, 7371.09ns compile). Discarding due consistent render regression risk","timestamp":1773504567259,"segment":3}
{"run":75,"commit":"4040c73","metric":13214.68,"metrics":{},"status":"discard","description":"Added direct default-syntax start-marker path in tokenize_root to bypass generic find_start_marker dispatch; result was effectively flat/slightly worse (5793.78ns parse, 7420.90ns compile) and introduced an unused-function warning","timestamp":1773504633094,"segment":3}
{"run":76,"commit":"4040c73","metric":12827.64,"metrics":{},"status":"discard","description":"Added Instructions::new_with_capacities and switched codegen subgenerators (for blocks/macros) to smaller initial buffers (64 instructions / 32 line+span infos, smaller pending_block vec) to cut compile-time over-allocation; first run improved to parse 5699.71ns and compile 7127.93ns, pending confirmation","timestamp":1773504693565,"segment":3}
{"run":77,"commit":"4040c73","metric":13044.6,"metrics":{},"status":"discard","description":"Second run for smaller subgenerator capacities landed essentially flat vs current baseline (parse 5824.87ns, compile 7219.73ns); collecting one more sample","timestamp":1773504707359,"segment":3}
{"run":78,"commit":"4040c73","metric":13310.87,"metrics":{},"status":"discard","description":"Third validation for reduced subgenerator capacities regressed (parse 5909.50ns, compile 7401.37ns), so no robust win; reverting this approach","timestamp":1773504719055,"segment":3}
{"run":79,"commit":"4040c73","metric":12938.16,"metrics":{},"status":"discard","description":"Reduced CodeGenerator pending_block/span_stack prealloc capacities from 32 to 16 to cut compile-time allocation overhead; first run improved to parse 5657.23ns and compile 7280.93ns, pending confirmation","timestamp":1773504751857,"segment":3}
{"run":80,"commit":"4040c73","metric":13031.58,"metrics":{},"status":"discard","description":"Second run for CodeGenerator capacity 16 remained slightly improved (parse 5741.54ns, compile 7290.04ns) with render guardrail stable; collecting third sample","timestamp":1773504763878,"segment":3}
{"run":81,"commit":"4040c73","metric":13276.2,"metrics":{},"status":"discard","description":"Third validation for CodeGenerator capacities 16/16 regressed to parse 5798.34ns and compile 7477.86ns, so the lower-capacity signal was not robust","timestamp":1773504773913,"segment":3}
{"run":82,"commit":"4040c73","metric":13425.61,"metrics":{},"status":"discard","description":"Replaced RESERVED_NAMES array contains() check with direct matches! in parse_assign_name; this regressed parse/compile (5809.73ns + 7615.88ns), so reverted","timestamp":1773504824638,"segment":3}
{"run":83,"commit":"4040c73","metric":13172.68,"metrics":{},"status":"discard","description":"Replaced lexer start-marker search with a single-pass manual byte scan (removing helper memchr call) and observed a modest first-run improvement (parse 5845.86ns, compile 7326.82ns), but introduced dead-code warning for now-unused utils::memchr; pending confirmation","timestamp":1773504873003,"segment":3}
{"run":84,"commit":"4040c73","metric":13207.35,"metrics":{},"status":"discard","description":"Second validation for manual lexer byte-scan was effectively flat (parse 5693.03ns, compile 7514.32ns) and still triggered unused memchr warning; not a robust win","timestamp":1773504883156,"segment":3}
{"run":85,"commit":"4040c73","metric":13100.59,"metrics":{},"status":"discard","description":"Control run on current kept code: parse 5704.43ns, compile 7396.16ns, render 68084.62ns (healthy guardrail)","timestamp":1773504902749,"segment":3}
{"run":86,"commit":"4040c73","metric":13000.48,"metrics":{},"status":"discard","description":"Retuned CodeGenerator pending_block/span_stack prealloc from 32 to 24; first run improved to parse 5744.30ns and compile 7256.18ns with render guardrail stable","timestamp":1773504931410,"segment":3}
{"run":87,"commit":"4040c73","metric":13144.04,"metrics":{},"status":"discard","description":"Second run for CodeGenerator capacity 24 was worse (parse 5703.94ns, compile 7440.10ns), indicating unstable signal; collecting final sample","timestamp":1773504942594,"segment":3}
{"run":88,"commit":"4040c73","metric":13089.53,"metrics":{},"status":"discard","description":"Third validation for CodeGenerator capacities 24/24 came back near baseline (parse 5750.98ns, compile 7338.55ns); no robust improvement over existing settings","timestamp":1773504952613,"segment":3}
{"run":89,"commit":"4040c73","metric":13271,"metrics":{},"status":"discard","description":"Specialized utils::memstr for 1-byte and 2-byte needles (used by lexer comment/raw searches); regressed parse/compile to 5801.60ns + 7469.40ns, so reverted","timestamp":1773505003810,"segment":3}
{"run":90,"commit":"4040c73","metric":12898.11,"metrics":{},"status":"discard","description":"Preallocated lexer state stack with capacity 8 in Tokenizer::new (instead of vec![..] capacity 1) to avoid stack Vec growth during nested template/block transitions; first run improved parse to 5531.57ns and compile to 7366.54ns, pending confirmation","timestamp":1773505043112,"segment":3}
{"run":91,"commit":"4040c73","metric":12629.07,"metrics":{},"status":"discard","description":"Second run for lexer stack preallocation strengthened improvement signal: parse 5423.34ns, compile 7205.73ns, render 67656.26ns; running third validation","timestamp":1773505053215,"segment":3}
{"run":92,"commit":"6f34de6","metric":12944.99,"metrics":{},"status":"keep","description":"Pre-size Tokenizer state stack to capacity 8 at construction (instead of single-element vec![]) to avoid stack Vec growth in nested block/variable transitions; validated across runs with parse 5.42-5.65µs and compile 7.20-7.37µs (this run 5647.14ns + 7297.85ns) and improved render guardrail","timestamp":1773505070277,"segment":3}
{"run":93,"commit":"6f34de6","metric":12968.75,"metrics":{},"status":"discard","description":"Retuned Tokenizer stack preallocation from 8 to 4; first run was slightly worse overall (parse 5691.08ns, compile 7277.67ns) but near noise band","timestamp":1773505099564,"segment":3}
{"run":94,"commit":"6f34de6","metric":12966.31,"metrics":{},"status":"discard","description":"Second run with Tokenizer stack capacity 4 remained slightly slower than capacity 8 baseline (parse 5741.05ns, compile 7225.26ns); keeping capacity 8","timestamp":1773505109560,"segment":3}
{"run":95,"commit":"6f34de6","metric":12926.27,"metrics":{},"status":"discard","description":"Tightened find_start_marker_memchr loop to compute absolute index once and use direct byte indexing for marker detection; first run improved to parse 5655.76ns and compile 7270.51ns, pending confirmation","timestamp":1773505153360,"segment":3}
{"run":96,"commit":"6f34de6","metric":13052.9,"metrics":{},"status":"discard","description":"Second run for tighter find_start_marker_memchr regressed toward baseline (parse 5749.19ns, compile 7303.71ns); collecting final sample","timestamp":1773505164139,"segment":3}
{"run":97,"commit":"6f34de6","metric":12958.67,"metrics":{},"status":"discard","description":"Third validation for tightened find_start_marker_memchr remained effectively flat/slightly worse than current best (parse 5542.97ns, compile 7415.70ns); not keeping","timestamp":1773505176813,"segment":3}
{"run":98,"commit":"6f34de6","metric":13084.63,"metrics":{},"status":"discard","description":"Control run after reverting lexer-marker loop tweaks: parse 5662.43ns, compile 7422.20ns, render 68051.43ns","timestamp":1773505198854,"segment":3}
{"run":99,"commit":"6f34de6","metric":13076.5,"metrics":{},"status":"discard","description":"Collapsed builtin map initialization into one cached tuple (`get_all_builtins`) and updated Environment::new to fetch all registries via a single OnceLock path; result was effectively flat/slightly worse (parse 5679.69ns, compile 7396.81ns)","timestamp":1773505287727,"segment":3}
{"run":100,"commit":"6f34de6","metric":12823.24,"metrics":{},"status":"discard","description":"Control run on current kept code under lower host noise: parse 5624.02ns, compile 7199.22ns, render 67926.76ns","timestamp":1773505312791,"segment":3}
{"run":101,"commit":"6f34de6","metric":13475.59,"metrics":{},"status":"discard","description":"Retuned Tokenizer stack preallocation from 8 to 12; this clearly regressed parse/compile (5791.02ns + 7684.57ns), so keeping capacity 8","timestamp":1773505335589,"segment":3}
{"run":102,"commit":"6f34de6","metric":13066.4,"metrics":{},"status":"discard","description":"Tried byte-based trailing-newline trim in Tokenizer::new to avoid multiple ends_with calls; regressed parse/compile to 5660.48ns + 7405.92ns","timestamp":1773505381240,"segment":3}
{"run":103,"commit":"6f34de6","metric":13230.79,"metrics":{},"status":"discard","description":"Tried parser block-name tracking with HashSet instead of BTreeSet; parse regressed to 5873.05ns and total parse+compile worsened (compile 7357.74ns)","timestamp":1773505419034,"segment":3}
{"run":104,"commit":"6f34de6","metric":12893.88,"metrics":{},"status":"discard","description":"Retuned Tokenizer stack capacity from 8 to 6; first run landed between prior samples (parse 5595.05ns, compile 7298.83ns), requiring confirmation","timestamp":1773505480156,"segment":3}
{"run":105,"commit":"6f34de6","metric":12884.44,"metrics":{},"status":"discard","description":"Second run with Tokenizer stack capacity 6 remained in similar band (parse 5654.62ns, compile 7229.82ns); performing direct A/B against current capacity 8 baseline","timestamp":1773505492039,"segment":3}
{"run":106,"commit":"6f34de6","metric":12724.11,"metrics":{},"status":"discard","description":"A/B baseline with current capacity-8 lexer stack measured parse 5429.52ns and compile 7294.59ns, clearly outperforming capacity-6 trials; keep capacity 8","timestamp":1773505517194,"segment":3}
{"run":107,"commit":"6f34de6","metric":13228.36,"metrics":{},"status":"discard","description":"Retuned parse_with_block assignment capacity from 2 to 3; this regressed parse/compile materially (5820.48ns + 7407.88ns)","timestamp":1773505541717,"segment":3}
{"run":108,"commit":"6f34de6","metric":13258.95,"metrics":{},"status":"discard","description":"Retuned instruction buffer capacity from 256 to 240; parse/compile regressed to 5768.07ns + 7490.88ns","timestamp":1773505576331,"segment":3}
{"run":109,"commit":"6f34de6","metric":14087.08,"metrics":{},"status":"discard","description":"Replaced iterator-based block/variable whitespace skip with manual byte loop in lexer tokenization; this regressed significantly (parse 6215.01ns, compile 7872.07ns)","timestamp":1773505614982,"segment":3}
{"run":110,"commit":"6f34de6","metric":13214.03,"metrics":{},"status":"discard","description":"Forced inline(always) on find_start_marker_memchr in lexer; regressed to parse 5851.73ns and compile 7362.30ns","timestamp":1773505641746,"segment":3}
{"run":111,"commit":"6f34de6","metric":13035.48,"metrics":{},"status":"discard","description":"Added adaptive subgenerator preallocation using block body size hints (custom Instructions::new_with_capacities + tuned pending-block capacity) to reduce block compile allocation overhead; first run showed a modest improvement to parse 5743.49ns, compile 7291.99ns pending confirmation","timestamp":1773505701430,"segment":3}
{"run":112,"commit":"6f34de6","metric":13305.99,"metrics":{},"status":"discard","description":"Second run for adaptive subgenerator capacities regressed (parse 5872.72ns, compile 7433.27ns), so signal is not robust and change will be reverted","timestamp":1773505712765,"segment":3}
{"run":113,"commit":"6f34de6","metric":13346.2,"metrics":{},"status":"discard","description":"Added compile_call_args fast path for empty arg lists with no caller to bypass setup/scans; run regressed (parse 5794.11ns, compile 7552.09ns) and showed elevated render guardrail","timestamp":1773505797060,"segment":3}
