{"run":98,"commit":"24d94c5","metric":7688.31,"metrics":{},"status":"discard","description":"Simplified TokenStream::current by folding error extraction into a single match (remove upfront is_err check); first run near best but not improved","timestamp":1773518244081,"segment":4}
{"run":99,"commit":"24d94c5","metric":7853.68,"metrics":{},"status":"discard","description":"Validation run for single-match TokenStream::current regressed significantly, so retaining prior is_err-gated version","timestamp":1773518253424,"segment":4}
{"run":100,"commit":"24d94c5","metric":8090.58,"metrics":{},"status":"discard","description":"Tried TokenStream::next state handoff via mem::swap with local Result (instead of mem::replace with next_token result); this regressed primary metric","timestamp":1773518288186,"segment":4}
{"run":101,"commit":"24d94c5","metric":7731.2,"metrics":{},"status":"discard","description":"Retuned lexer state stack preallocation from 8 to 4 for smaller templates; remained slower than current best comparison sample","timestamp":1773518328429,"segment":4}
{"run":102,"commit":"24d94c5","metric":7749.84,"metrics":{},"status":"discard","description":"Validation run for lexer stack capacity 4 remained slower than best despite good compile guardrails; keeping capacity 8","timestamp":1773518334872,"segment":4}
{"run":103,"commit":"24d94c5","metric":7875.4,"metrics":{},"status":"discard","description":"Refactored TokenStream to store current token and span in separate fields (Result<Option<Token>> + current_span) to shrink per-step state payload; primary metric regressed","timestamp":1773518397478,"segment":4}
{"run":104,"commit":"24d94c5","metric":7875.98,"metrics":{},"status":"discard","description":"Validation run for split current-token/current-span TokenStream design remained slower than current best and increased guardrail noise","timestamp":1773518402734,"segment":4}
{"run":105,"commit":"24d94c5","metric":7764.24,"metrics":{},"status":"discard","description":"Marked parser unexpected/unexpected_eof constructors as cold to shrink hot error-free path; initial run looked promising but required variance check","timestamp":1773518496952,"segment":4}
{"run":106,"commit":"24d94c5","metric":7764.97,"metrics":{},"status":"discard","description":"Second run for cold parser error constructors stayed near prior sample but still not below existing best","timestamp":1773518502200,"segment":4}
{"run":107,"commit":"24d94c5","metric":7849.12,"metrics":{},"status":"discard","description":"Third validation for cold parser error constructors regressed (render component rose), so no robust gain","timestamp":1773518506010,"segment":4}
{"run":108,"commit":"24d94c5","metric":7705.65,"metrics":{},"status":"discard","description":"Marked parser syntax_error constructor as cold to reduce error-path code weight in hot parse loops; first sample improved but required variance validation","timestamp":1773518566139,"segment":4}
{"run":109,"commit":"24d94c5","metric":7714.27,"metrics":{},"status":"discard","description":"Second run for cold syntax_error remained in strong band but still above best sample; continuing to validate","timestamp":1773518572163,"segment":4}
{"run":110,"commit":"24d94c5","metric":7798.91,"metrics":{},"status":"discard","description":"Third validation for cold syntax_error regressed, so gain is not robust enough to keep","timestamp":1773518576263,"segment":4}
{"run":111,"commit":"db4d1b5","metric":7600.92,"metrics":{},"status":"keep","description":"Retune CodeGenerator pending_block/span_stack initial capacities from 32 to 8 for smaller template compile workloads; improved comparison metric to 7600.92ns with better compile component","timestamp":1773518630274,"segment":4}
{"run":112,"commit":"db4d1b5","metric":7648.68,"metrics":{},"status":"discard","description":"Validation run for CodeGenerator capacity retune stayed in improved band (7648.68ns) but above best sample; keep commit and monitor variance","timestamp":1773518642490,"segment":4}
{"run":113,"commit":"db4d1b5","metric":7620.68,"metrics":{},"status":"discard","description":"Retuned CodeGenerator pending/span capacities from 8 to 12; close but slower than current best and raised render guardrail","timestamp":1773518675886,"segment":4}
{"run":114,"commit":"db4d1b5","metric":7930.75,"metrics":{},"status":"discard","description":"Validation run for CodeGenerator capacity 12 regressed heavily, confirming capacity 8 is better","timestamp":1773518681122,"segment":4}
{"run":115,"commit":"db4d1b5","metric":7677.98,"metrics":{},"status":"discard","description":"Retuned CodeGenerator pending/span capacities from 8 down to 6; comparison metric regressed","timestamp":1773518712775,"segment":4}
{"run":116,"commit":"db4d1b5","metric":7649.98,"metrics":{},"status":"discard","description":"Retuned parser subparse statement-vector capacity from 16 to 10 on latest baseline; no primary improvement","timestamp":1773518749078,"segment":4}
{"run":117,"commit":"db4d1b5","metric":7923.66,"metrics":{},"status":"discard","description":"Validation run for parser subparse capacity 10 regressed heavily, confirming no robust gain","timestamp":1773518755158,"segment":4}
{"run":118,"commit":"db4d1b5","metric":7689.78,"metrics":{},"status":"discard","description":"Retuned CodeGenerator pending/span capacities from 8 to 9; primary comparison metric regressed","timestamp":1773518791089,"segment":4}
{"run":119,"commit":"db4d1b5","metric":7656.99,"metrics":{},"status":"discard","description":"Restructured TokenStream::next to compute next token into local before mem::replace; remained slower than current best","timestamp":1773518837648,"segment":4}
{"run":120,"commit":"db4d1b5","metric":7672.36,"metrics":{},"status":"discard","description":"Validation run for local-next TokenStream::next formulation stayed below baseline but above best sample; not keeping","timestamp":1773518843251,"segment":4}
{"run":121,"commit":"db4d1b5","metric":7772.54,"metrics":{},"status":"discard","description":"Retried Vec-based codegen filter/test local-id tables on latest baseline; compile component improved but primary metric was worse and render guardrail regressed","timestamp":1773518890308,"segment":4}
{"run":122,"commit":"db4d1b5","metric":7701.01,"metrics":{},"status":"discard","description":"Validation run for Vec-based codegen local-id tables remained above best and continued to show elevated render guardrails","timestamp":1773518896331,"segment":4}
{"run":123,"commit":"db4d1b5","metric":7706.54,"metrics":{},"status":"discard","description":"Retuned Instructions default capacities from 256/128 to 224/112 to reduce allocation footprint; remained slower than current best","timestamp":1773518927395,"segment":4}
{"run":124,"commit":"db4d1b5","metric":7871.5,"metrics":{},"status":"discard","description":"Marked lexer syntax_error helper as cold to reduce hot-path code size; this regressed primary comparison metric","timestamp":1773518969727,"segment":4}
{"run":125,"commit":"db4d1b5","metric":7603.35,"metrics":{},"status":"discard","description":"Control run on current kept baseline measured 7603.35ns (compile 3911.62ns, render 3691.73ns), confirming gains hold with expected noise","timestamp":1773518996204,"segment":4}
{"run":126,"commit":"db4d1b5","metric":7753.91,"metrics":{},"status":"discard","description":"Replaced non-unicode lex_identifier iterator chain with manual byte loop to reduce iterator/closure overhead; primary comparison metric regressed","timestamp":1773519041174,"segment":4}
{"run":127,"commit":"db4d1b5","metric":0,"metrics":{},"status":"crash","description":"Prototype removing Arc from BasicStore template map failed to compile because Environment derives Clone and CompiledTemplate does not implement Clone","timestamp":1773519089599,"segment":4}
{"run":128,"commit":"db4d1b5","metric":7639.65,"metrics":{},"status":"discard","description":"Prototype thread-local reuse of CodeGenerator pending_block/span_stack buffers (take from pool in new, recycle in finish); first run was close but above best","timestamp":1773519211872,"segment":4}
{"run":129,"commit":"5f16a5d","metric":7569.42,"metrics":{},"status":"keep","description":"Reuse CodeGenerator pending_block/span_stack buffers via small thread-local pools to cut repeated compile allocations; improved comparison metric to 7569.42ns with lower compile component","timestamp":1773519222180,"segment":4}
{"run":130,"commit":"5f16a5d","metric":7597.98,"metrics":{},"status":"discard","description":"Validation run for CodeGenerator buffer pooling remained in improved band but above best sample (7597.98ns); keeping pooled-buffer commit","timestamp":1773519228229,"segment":4}
{"run":131,"commit":"5f16a5d","metric":7692.62,"metrics":{},"status":"discard","description":"Simplified CodeGenerator buffer pools from Vec stacks to single-slot Option caches to reduce pool bookkeeping; this regressed primary metric","timestamp":1773519274068,"segment":4}
{"run":132,"commit":"5f16a5d","metric":7658.21,"metrics":{},"status":"discard","description":"Tested pooling only pending_block (disable span_stack pooling) in CodeGenerator; primary metric regressed versus full pooling","timestamp":1773519326175,"segment":4}
{"run":133,"commit":"5f16a5d","metric":7760.99,"metrics":{},"status":"discard","description":"Tested pooling only span_stack (disable pending_block pooling) in CodeGenerator; this regressed primary metric","timestamp":1773519365441,"segment":4}
{"run":134,"commit":"5f16a5d","metric":7600.26,"metrics":{},"status":"discard","description":"Retuned CodeGenerator pooled-buffer max capacity from 64 to 32 to drop oversized recycled buffers sooner; near best but not improved","timestamp":1773519412494,"segment":4}
{"run":135,"commit":"5f16a5d","metric":7693.19,"metrics":{},"status":"discard","description":"Validation run for pooled-buffer max capacity 32 regressed, so keep capacity threshold 64","timestamp":1773519420138,"segment":4}
{"run":136,"commit":"5f16a5d","metric":7636.8,"metrics":{},"status":"discard","description":"Control run on current pooled-buffer baseline measured 7636.80ns; confirms sustained improvement band with normal variance","timestamp":1773519446858,"segment":4}
{"run":137,"commit":"5f16a5d","metric":7661.54,"metrics":{},"status":"discard","description":"Added Instructions line/span metadata buffer pooling (thread-local recycle in Drop/new) to reduce repeated compile allocations; compile guardrail improved but primary metric regressed and render guardrail worsened","timestamp":1773519645913,"segment":4}
{"run":138,"commit":"5f16a5d","metric":0,"metrics":{},"status":"crash","description":"Attempted to bias parser current() error branch with std::hint::unlikely, but likely/unlikely is unstable on this toolchain and failed to compile","timestamp":1773519703980,"segment":4}
{"run":139,"commit":"5f16a5d","metric":7556.64,"metrics":{},"status":"discard","description":"Retuned pooled CodeGenerator buffer minimum reserve to 7 entries for pending_block/span_stack; primary improved but render guardrail spiked (string_heavy 11022ns), treated as suspicious and awaiting validation","timestamp":1773519755704,"segment":4}
{"run":140,"commit":"5f16a5d","metric":7616.04,"metrics":{},"status":"discard","description":"Validation for reserve-to-7 pooled CodeGenerator buffers regressed and again showed high render guardrails; not keeping","timestamp":1773519778146,"segment":4}
{"run":141,"commit":"5f16a5d","metric":7695.96,"metrics":{},"status":"discard","description":"Added tiny-map BasicStore::get linear-scan fast path for <=2 templates to target comparison render lookups; primary metric regressed","timestamp":1773519824031,"segment":4}
{"run":142,"commit":"5f16a5d","metric":7625.08,"metrics":{},"status":"discard","description":"Retuned CodeGenerator pooled-buffer max capacity from 64 to 48; primary metric regressed","timestamp":1773519863995,"segment":4}
{"run":143,"commit":"5f16a5d","metric":7806.08,"metrics":{},"status":"discard","description":"Replaced parser block-name tracking from BTreeSet to Vec linear duplicate checks (few expected blocks) to reduce set overhead; this regressed primary metric","timestamp":1773519932189,"segment":4}
{"run":144,"commit":"5f16a5d","metric":7705.15,"metrics":{},"status":"discard","description":"Retuned CodeGenerator pool depth from 32 to 16 cached buffers; primary metric regressed","timestamp":1773519969491,"segment":4}
{"run":145,"commit":"ca6548d","metric":7517.82,"metrics":{},"status":"keep","description":"Increased CodeGenerator pooled-buffer depth from 32 to 64 entries to improve reuse across repeated compiles in benchmark loop; improved comparison metric to 7517.82ns","timestamp":1773520001985,"segment":4}
