{"type":"config","name":"Optimize MiniJinja render benchmark (all_elements)","metricName":"render_ns","metricUnit":"ns","bestDirection":"lower"}
{"run":1,"commit":"d6e822b","metric":40876.3,"metrics":{},"status":"keep","description":"Set up autoresearch harness and recorded baseline render benchmark","timestamp":1773439303738,"segment":0}
{"run":2,"commit":"d6e822b","metric":40879.88,"metrics":{},"status":"discard","description":"Measured baseline noise floor without code changes","timestamp":1773439336590,"segment":0}
{"run":3,"commit":"d6e822b","metric":41628.59,"metrics":{},"status":"discard","description":"Tried Output fast-path branches for string targets to avoid trait dispatch in write_str/write_char","timestamp":1773439443712,"segment":0}
{"run":4,"commit":"6df6c1c","metric":37906.9,"metrics":{},"status":"keep","description":"Optimize upper filter with ASCII no-op fast path to avoid redundant case conversion","timestamp":1773439516019,"segment":0}
{"run":5,"commit":"6df6c1c","metric":38273.11,"metrics":{},"status":"discard","description":"Tried ASCII-specific to_ascii_uppercase path in upper filter for lowercase ASCII strings","timestamp":1773439554975,"segment":0}
{"run":6,"commit":"32b2042","metric":36304.36,"metrics":{},"status":"keep","description":"Add html-escape precheck and direct write_str fast path for strings without escapable chars","timestamp":1773439625728,"segment":0}
{"run":7,"commit":"32b2042","metric":36454.1,"metrics":{},"status":"discard","description":"Specialized HTML formatter for primitive ValueRepr variants to bypass Value Display dispatch","timestamp":1773439690635,"segment":0}
{"run":8,"commit":"32b2042","metric":37220.38,"metrics":{},"status":"discard","description":"Attempted to force-inline write_with_html_escaping in utils hot path","timestamp":1773439824687,"segment":0}
{"run":9,"commit":"32b2042","metric":36980.8,"metrics":{},"status":"discard","description":"Tried simpler any(matches!) implementation for needs_html_escaping byte scan","timestamp":1773439870725,"segment":0}
{"run":10,"commit":"32b2042","metric":36764.98,"metrics":{},"status":"discard","description":"Control run without code changes to re-check variance after recent edits","timestamp":1773439902177,"segment":0}
{"run":11,"commit":"32b2042","metric":36984.05,"metrics":{},"status":"discard","description":"Second control run; observed benchmark noise drifting higher on current machine load","timestamp":1773439905593,"segment":0}
{"run":12,"commit":"743233a","metric":36029.95,"metrics":{},"status":"keep","description":"Bypass formatter callback for default formatter using formatter_is_default fast path","timestamp":1773440014172,"segment":0}
{"run":13,"commit":"743233a","metric":36296.22,"metrics":{},"status":"discard","description":"Tried force-inlining Environment::format after adding default formatter fast path","timestamp":1773440043834,"segment":0}
{"run":14,"commit":"743233a","metric":36603.19,"metrics":{},"status":"discard","description":"Rewrote undefined-check match in Environment::format as early-return if branch","timestamp":1773440083368,"segment":0}
{"run":15,"commit":"743233a","metric":36776.37,"metrics":{},"status":"discard","description":"Forced inline on get_or_lookup_local cache helper in VM","timestamp":1773440168813,"segment":0}
{"run":16,"commit":"743233a","metric":36418.95,"metrics":{},"status":"discard","description":"Added aggressive inlining hints to VM stack push/pop and call-arg helpers","timestamp":1773440216510,"segment":0}
{"run":17,"commit":"26a5f32","metric":35491.54,"metrics":{},"status":"keep","description":"Specialize VM Emit for default formatter to bypass Environment::format call and branch directly to write_escaped","timestamp":1773440367479,"segment":0}
{"run":18,"commit":"26a5f32","metric":35844.08,"metrics":{},"status":"discard","description":"Tested Value handle registry switch from BTreeMap to HashMap for Value::serialize roundtrip path","timestamp":1773440564004,"segment":0}
{"run":19,"commit":"26a5f32","metric":36268.88,"metrics":{},"status":"discard","description":"Tried larger initial VM stack capacity (32) to reduce Value Vec reallocations","timestamp":1773440587610,"segment":0}
{"run":20,"commit":"26a5f32","metric":0,"metrics":{},"status":"discard","description":"Checked existing unit assertion confirming Value size is 24 bytes on 64-bit targets","timestamp":1773440616689,"segment":0}
{"run":21,"commit":"26a5f32","metric":37697.27,"metrics":{},"status":"discard","description":"Tried unsafe unchecked VM stack pop to reduce Option/unwrap overhead on Value moves","timestamp":1773440669111,"segment":0}
{"run":22,"commit":"26a5f32","metric":35784.51,"metrics":{},"status":"discard","description":"Refactored internal Value roundtrip handle registry from keyed map to stack-based pop path in serializer","timestamp":1773440788339,"segment":0}
{"run":23,"commit":"26a5f32","metric":42911.13,"metrics":{},"status":"discard","description":"Switched VM frame locals from BTreeMap to HashMap to test faster local lookup/store","timestamp":1773440838317,"segment":0}
{"run":24,"commit":"26a5f32","metric":36300.78,"metrics":{},"status":"discard","description":"Hoisted default formatter and strict undefined checks out of VM loop for Emit instruction","timestamp":1773440890649,"segment":0}
{"run":25,"commit":"26a5f32","metric":35740.88,"metrics":{},"status":"discard","description":"Tried manual ASCII lowercase byte scan in upper filter no-op fast path","timestamp":1773440928111,"segment":0}
{"run":26,"commit":"26a5f32","metric":36112.3,"metrics":{},"status":"discard","description":"Repeat measurement for manual ASCII lowercase scan in upper fast path","timestamp":1773440932469,"segment":0}
{"run":27,"commit":"26a5f32","metric":35682.62,"metrics":{},"status":"discard","description":"Added Object::get_value_by_str path and specialized map lookups to avoid temporary Value key allocations (run 1)","timestamp":1773441099217,"segment":0}
{"run":28,"commit":"7ac4d00","metric":35281.91,"metrics":{},"status":"keep","description":"Add Object::get_value_by_str fast path and optimize Value-keyed map string lookups for small maps","timestamp":1773441121355,"segment":0}
{"run":29,"commit":"7ac4d00","metric":36889.97,"metrics":{},"status":"discard","description":"Tried manual loop implementation for small Value-map string lookups instead of iterator find_map","timestamp":1773441179033,"segment":0}
{"run":30,"commit":"7ac4d00","metric":35868.81,"metrics":{},"status":"discard","description":"Tuned Value-map get_value_by_str linear-scan threshold from <=8 to <=16","timestamp":1773441205180,"segment":0}
{"run":31,"commit":"7ac4d00","metric":35812.83,"metrics":{},"status":"discard","description":"Tuned Value-map get_value_by_str linear-scan threshold from <=8 to <=4","timestamp":1773441232156,"segment":0}
{"run":32,"commit":"7ac4d00","metric":35828.45,"metrics":{},"status":"discard","description":"Control run on current best code to observe machine noise after Value lookup optimization","timestamp":1773441263491,"segment":0}
{"run":33,"commit":"7ac4d00","metric":36351.24,"metrics":{},"status":"discard","description":"Forced inline on Value::get_attr and get_attr_fast after get_value_by_str refactor","timestamp":1773441292529,"segment":0}
{"run":34,"commit":"7ac4d00","metric":36383.46,"metrics":{},"status":"discard","description":"Added get_value_by_str overrides for MergeDict and Namespace objects to avoid temporary Value keys","timestamp":1773441333151,"segment":0}
{"run":35,"commit":"7ac4d00","metric":35844.41,"metrics":{},"status":"discard","description":"Tried splitting Option arg-count handling at VM call sites to favor fixed-arity paths","timestamp":1773441581711,"segment":0}
{"run":36,"commit":"6f787f7","metric":35115.55,"metrics":{},"status":"keep","description":"Use string-keyed BTreeMap in hidden context! builder to avoid Value-key conversion overhead","timestamp":1773441669680,"segment":0}
{"run":37,"commit":"6f787f7","metric":35908.53,"metrics":{},"status":"discard","description":"Follow-up measurement of string-keyed context map showed significant run-to-run variance under current load","timestamp":1773441674622,"segment":0}
{"run":38,"commit":"6f787f7","metric":35623.05,"metrics":{},"status":"discard","description":"Tried static-str context map keys with direct Object impl for BTreeMap<&'static str, _> to eliminate key allocations","timestamp":1773441763496,"segment":0}
{"run":39,"commit":"6f787f7","metric":0,"metrics":{},"status":"crash","description":"Prototype context! ContextMap object failed to compile due Debug impl using wrong iterator item type","timestamp":1773441847850,"segment":0}
{"run":40,"commit":"6f787f7","metric":37391.27,"metrics":{},"status":"discard","description":"Tested custom Vec-backed ContextMap object for context! macro to avoid tree map overhead","timestamp":1773441871836,"segment":0}
{"run":41,"commit":"8801478","metric":35078.12,"metrics":{},"status":"keep","description":"Match ValueRepr::String/SmallStr directly in small Value-map string lookup fast path","timestamp":1773441943979,"segment":0}
{"run":42,"commit":"8801478","metric":35244.14,"metrics":{},"status":"discard","description":"Tried manual loop instead of find_map closure for small Value-map string-key lookup","timestamp":1773441975094,"segment":0}
{"run":43,"commit":"8801478","metric":36531.58,"metrics":{},"status":"discard","description":"Tried thread-local Arc<str> key interning in context! builder to avoid repeated Arc allocations","timestamp":1773442027883,"segment":0}
{"run":44,"commit":"0d5feab","metric":33950.2,"metrics":{},"status":"keep","description":"Add Loop::get_value_by_str fast path for loop attribute access to skip temporary Value key creation","timestamp":1773442093603,"segment":0}
{"run":45,"commit":"0d5feab","metric":34369.14,"metrics":{},"status":"discard","description":"Tried VM-level special case for loop.index in GetAttr to bypass generic object attribute lookup","timestamp":1773442151612,"segment":0}
{"run":46,"commit":"0d5feab","metric":35173.83,"metrics":{},"status":"discard","description":"Tried restructuring Loop::get_value_by_str to defer len computation to specific match arms","timestamp":1773442185566,"segment":0}
{"run":47,"commit":"0d5feab","metric":34555.66,"metrics":{},"status":"discard","description":"Forced inline on Loop get_value/get_value_by_str after loop attribute fast path","timestamp":1773442227733,"segment":0}
{"run":48,"commit":"0d5feab","metric":34327.47,"metrics":{},"status":"discard","description":"Forced inline(always) for Output write methods and fmt::Write impl methods","timestamp":1773442334096,"segment":0}
{"run":49,"commit":"0d5feab","metric":34463.22,"metrics":{},"status":"discard","description":"Control run on current best commit to monitor benchmark variance after recent experiments","timestamp":1773442357859,"segment":0}
{"run":50,"commit":"0d5feab","metric":34177.73,"metrics":{},"status":"discard","description":"Tried early-return fast path for loop.index before full Loop attribute match","timestamp":1773442412668,"segment":0}
{"run":51,"commit":"0d5feab","metric":35425.78,"metrics":{},"status":"discard","description":"Cached loop object Value in LoopState to avoid rebuilding Value::from_dyn_object on loop lookups","timestamp":1773442495540,"segment":0}
{"run":52,"commit":"0d5feab","metric":34686.84,"metrics":{},"status":"discard","description":"Retried ASCII to_ascii_uppercase path for upper filter after recent VM/object optimizations","timestamp":1773442557996,"segment":0}
{"run":53,"commit":"0d5feab","metric":0,"metrics":{},"status":"crash","description":"Prototype Vec-backed Locals failed due visibility and iterator type mismatches across vm modules","timestamp":1773442653281,"segment":0}
{"run":54,"commit":"8064d7a","metric":33498.7,"metrics":{},"status":"keep","description":"Use Vec-backed Locals with linear lookup/update instead of BTreeMap for small VM scope frames","timestamp":1773442697504,"segment":0}
{"run":55,"commit":"8064d7a","metric":33527.02,"metrics":{},"status":"discard","description":"Tried manual for-loop implementations for Locals insert/get instead of iterator find/find_map","timestamp":1773442726260,"segment":0}
{"run":56,"commit":"38540fd","metric":33040.37,"metrics":{},"status":"keep","description":"Preallocate Vec-backed Locals with capacity 4 to reduce scope-local insertion reallocations","timestamp":1773442763817,"segment":0}
{"run":57,"commit":"0e18446","metric":32796.55,"metrics":{},"status":"keep","description":"Tune initial Locals vector capacity from 4 to 8 for lower reallocation overhead","timestamp":1773442793117,"segment":0}
{"run":58,"commit":"0e18446","metric":0,"metrics":{},"status":"crash","description":"Run interrupted by late-night continuation guard before benchmark execution","timestamp":1773442833098,"segment":0}
{"run":59,"commit":"0ab5ed6","metric":32737.95,"metrics":{},"status":"keep","description":"Further tune initial Locals vector capacity from 8 to 16","timestamp":1773442869337,"segment":0}
{"run":60,"commit":"859d849","metric":32312.83,"metrics":{},"status":"keep","description":"Tune initial Locals vector capacity from 16 to 32 for lower allocation churn in deep loop scopes","timestamp":1773442903210,"segment":0}
{"run":61,"commit":"859d849","metric":32953.12,"metrics":{},"status":"discard","description":"Tried increasing Locals initial vector capacity to 64","timestamp":1773442934245,"segment":0}
{"run":62,"commit":"859d849","metric":32702.48,"metrics":{},"status":"discard","description":"Expanded harness to also emit parse/compile secondary metrics; render metric slightly higher on first run","timestamp":1773443064747,"segment":0}
{"run":63,"commit":"f783ed3","metric":32276.05,"metrics":{},"status":"keep","description":"Expand autoresearch harness with parse/compile secondary metrics while preserving render as primary","timestamp":1773443125499,"segment":0}
{"run":64,"commit":"f783ed3","metric":32539.39,"metrics":{},"status":"discard","description":"Tried Locals initial capacity 24 instead of 32 under expanded multi-metric harness","timestamp":1773443172888,"segment":0}
{"run":65,"commit":"f783ed3","metric":32658.86,"metrics":{},"status":"discard","description":"Tried Locals initial capacity 40 instead of 32","timestamp":1773443204337,"segment":0}
{"run":66,"commit":"f783ed3","metric":33207.68,"metrics":{},"status":"discard","description":"Tried reverse-iteration strategy for Locals get/insert to favor recently touched variables","timestamp":1773443235896,"segment":0}
{"run":67,"commit":"f783ed3","metric":33181.32,"metrics":{},"status":"discard","description":"Added aggressive inline(always) hints to Vec-backed Locals helper methods","timestamp":1773443267729,"segment":0}
{"run":68,"commit":"f783ed3","metric":32957.03,"metrics":{},"status":"discard","description":"Retested larger VM evaluation stack capacity (32) with current optimized locals design","timestamp":1773443299777,"segment":0}
{"run":69,"commit":"f783ed3","metric":33150.06,"metrics":{},"status":"discard","description":"Replaced Value handle BTreeMap with Vec<Option<Value>> indexed storage for serde roundtrip path","timestamp":1773443376856,"segment":0}
{"run":70,"commit":"f783ed3","metric":32631.18,"metrics":{},"status":"discard","description":"Tried last-entry fast path in Locals::insert for repeated writes to same variable","timestamp":1773443412613,"segment":0}
{"run":71,"commit":"f783ed3","metric":33325.52,"metrics":{},"status":"discard","description":"Added first-entry shortcut in Locals::get before linear scan","timestamp":1773443453739,"segment":0}
{"run":72,"commit":"f783ed3","metric":33567.38,"metrics":{},"status":"discard","description":"Tried pointer-equality fast path for Vec-backed Locals key matching before string equality","timestamp":1773443566428,"segment":0}
{"run":73,"commit":"f783ed3","metric":34920.24,"metrics":{},"status":"discard","description":"Tried Locals last-lookup index cache via Cell to speed repeated variable access","timestamp":1773443612804,"segment":0}
{"run":74,"commit":"f783ed3","metric":33234.05,"metrics":{},"status":"discard","description":"Added has_loop_local flag to skip locals scan on loop lookups unless shadowed","timestamp":1773443677238,"segment":0}
{"run":75,"commit":"de4d929","metric":32215.17,"metrics":{},"status":"keep","description":"Tune Value-keyed map string-lookup linear-scan threshold from <=8 to <=12","timestamp":1773443709953,"segment":0}
{"run":76,"commit":"de4d929","metric":32536.46,"metrics":{},"status":"discard","description":"Tried raising Value-map string-lookup linear-scan threshold from <=12 to <=16","timestamp":1773443729191,"segment":0}
{"run":77,"commit":"de4d929","metric":32615.55,"metrics":{},"status":"discard","description":"Tried lowering Value-map string-lookup linear-scan threshold from <=12 to <=10","timestamp":1773443751151,"segment":0}
{"run":78,"commit":"de4d929","metric":35150.39,"metrics":{},"status":"discard","description":"Attempted force-inline on Context::load hot variable lookup path","timestamp":1773443797958,"segment":0}
{"run":79,"commit":"de4d929","metric":32243.48,"metrics":{},"status":"discard","description":"Tried LoopState local index + atomic store instead of atomic fetch_add in loop iteration","timestamp":1773443864383,"segment":0}
{"run":80,"commit":"de4d929","metric":31879.23,"metrics":{},"status":"discard","description":"Control run on unchanged code showed lower render time; treated as measurement variance","timestamp":1773443888842,"segment":0}
{"run":81,"commit":"de4d929","metric":32457.68,"metrics":{},"status":"discard","description":"Tried Vec-accumulate then collect-to-BTreeMap strategy in context! builder instead of direct BTreeMap inserts","timestamp":1773443949650,"segment":0}
{"run":82,"commit":"de4d929","metric":31859.38,"metrics":{},"status":"discard","description":"Initial run for VM stack capacity 24 showed strong improvement; running confirmation","timestamp":1773443999490,"segment":0}
{"run":83,"commit":"791d5b5","metric":31828.45,"metrics":{},"status":"keep","description":"Tune VM evaluation stack initial capacity from 16 to 24","timestamp":1773444029216,"segment":0}
{"run":84,"commit":"791d5b5","metric":32525.07,"metrics":{},"status":"discard","description":"Tried VM stack initial capacity 20 (vs 24)","timestamp":1773444055769,"segment":0}
{"run":85,"commit":"791d5b5","metric":32272.79,"metrics":{},"status":"discard","description":"Tried VM stack initial capacity 28 (vs 24)","timestamp":1773444084495,"segment":0}
{"run":86,"commit":"791d5b5","metric":31931.31,"metrics":{},"status":"discard","description":"Tried VM stack initial capacity 22 (vs 24)","timestamp":1773444117439,"segment":0}
{"run":87,"commit":"791d5b5","metric":31948.24,"metrics":{},"status":"discard","description":"Tried VM stack initial capacity 26 (vs 24)","timestamp":1773444149976,"segment":0}
{"run":88,"commit":"791d5b5","metric":31885.42,"metrics":{},"status":"discard","description":"Retested Locals initial capacity 40 under new stack-capacity-24 baseline","timestamp":1773444180540,"segment":0}
{"run":89,"commit":"791d5b5","metric":31801.76,"metrics":{},"status":"discard","description":"Tried Locals initial capacity 36 (first run showed marginal improvement, awaiting confirmation)","timestamp":1773444213668,"segment":0}
{"run":90,"commit":"791d5b5","metric":32178.06,"metrics":{},"status":"discard","description":"Confirmation run for Locals capacity 36 regressed; keeping capacity 32","timestamp":1773444220960,"segment":0}
{"run":91,"commit":"791d5b5","metric":31902.02,"metrics":{},"status":"discard","description":"Tried reducing Context frame-stack initial capacity from 32 to 16","timestamp":1773444315072,"segment":0}
{"run":92,"commit":"791d5b5","metric":31859.38,"metrics":{},"status":"discard","description":"Tried reducing Context frame-stack initial capacity from 32 to 24","timestamp":1773444340379,"segment":0}
{"run":93,"commit":"791d5b5","metric":31688.15,"metrics":{},"status":"discard","description":"Initial run for Context frame-stack capacity 40 showed improvement; running confirmation","timestamp":1773444381682,"segment":0}
{"run":94,"commit":"79f233b","metric":31505.86,"metrics":{},"status":"keep","description":"Tune Context frame-stack initial capacity from 32 to 40","timestamp":1773444406887,"segment":0}
{"run":95,"commit":"79f233b","metric":32017.91,"metrics":{},"status":"discard","description":"Tried increasing Context frame-stack initial capacity from 40 to 48","timestamp":1773444431983,"segment":0}
{"run":96,"commit":"79f233b","metric":31690.11,"metrics":{},"status":"discard","description":"Tried reducing Context frame-stack initial capacity from 40 to 36","timestamp":1773444465130,"segment":0}
{"run":97,"commit":"79f233b","metric":32365.88,"metrics":{},"status":"discard","description":"Tried Context frame-stack initial capacity 44","timestamp":1773444493127,"segment":0}
{"run":98,"commit":"79f233b","metric":31919.27,"metrics":{},"status":"discard","description":"Tried VM value stack initial capacity 23 under context-stack-40 baseline","timestamp":1773444517674,"segment":0}
{"run":99,"commit":"79f233b","metric":32829.75,"metrics":{},"status":"discard","description":"Tried VM value stack initial capacity 25 under context-stack-40 baseline","timestamp":1773444541295,"segment":0}
{"run":100,"commit":"79f233b","metric":32882.16,"metrics":{},"status":"discard","description":"Prototype sorted Vec-backed ContextMap with binary-search lookups for context! macro values","timestamp":1773444618791,"segment":0}
{"run":101,"commit":"79f233b","metric":32538.09,"metrics":{},"status":"discard","description":"Preallocated auto_escape_stack with capacity 8 in VM eval loop","timestamp":1773444663004,"segment":0}
